sale_id,sales_amount,product_category,product_name,location_id,date,customer_id
98253,202.45339879086833,Health & Personal Care,Herbalife Herbal Aloe Drink (Concentrate)16 oz - New Mango Flavor!,1132,2019-10-31,48015
98254,862.9171176348217,Books,Wake Up Little Susie,3606,2019-10-31,27541
98255,309.3372771348582,Beauty,"OPI The Bond Girls Collection, Tiffany Case 0.5 fl oz (15 ml)",2608,2019-10-31,6817
98256,42.85041856144232,PC,Micro SD card holder - BLUE,2619,2019-10-31,34900
98257,458.3311152477396,Musical Instruments,D'Addario Helicore Hybrid Bass Single A String,2291,2019-10-31,7101
98258,46.06486807254066,Beauty,Philips Norelco 1250X/46 Shaver 8100,1557,2019-10-31,12462
98259,737.434753820272,Musical Instruments,Violinsmart 3/4 size violin bow,2229,2019-10-31,14440
98260,289.04746307547714,Musical Instruments,Epiphone Gigbag for Solidbody Electric Guitars,1402,2019-10-31,15175
98261,248.29563349655254,Mobile_Apps,Galaxy Bowling HD,1905,2019-10-31,26155
98262,796.0159462010301,Camera,Egg Solution Egg Photo 360Deg Panoramic Lens with Virtual Tour Image Software,1021,2019-10-31,32305
98263,394.4335480279125,Office Products,Brother Printer Drum Unit 123,2972,2019-10-31,1931
98264,257.0720761783839,Electronics,Denon AVR-S900W 7.2-Channel Network A/V Receiver with Bluetooth and Wi-Fi,2134,2019-10-31,32565
98265,279.25685338181677,Apparel,Footed Pajamas Creamsicle Infant Fleece,3059,2019-10-31,4558
98266,95.67285108149353,Major Appliances,"GE PS978STSS Profile 30"" Stainless Steel Electric Slide-In Smoothtop Double Oven Range - Convection",1034,2019-10-31,19692
98267,998.6345928385455,Health & Personal Care,"32 COUNT Mr. Clean Magic Reach Scrubbing Tub and Shower Pads, 4 Pack- 8 count ea = 32 refills MagicReach",3046,2019-10-31,49024
98268,545.7372409168969,Baby,Four Lil Monkeys Canvas Art Two Pack,2666,2019-10-31,32913
98269,379.5678431125352,Electronics,Sennheiser On-Ear 926MHz Wireless RF Headphones with Charging Cradle,1223,2019-10-31,7334
98270,148.1689671431978,Digital_Video_Games,Gardenscapes: Mansion Makeover [Download],2125,2019-10-31,34125
98271,386.41827653782036,Major Appliances,Haier 18-Bottle Capacity Wine Tower Storage,2808,2019-10-31,17230
98272,311.275434066673,Furniture,"Coaster Home Furnishings Satin Metal Spider Coat and Purse Rack, Black",1573,2019-10-31,23544
98273,948.4504013494467,Automotive,"Dura Faucet Classical RV Lavatory Faucet - RV Bathroom Faucet For Travel Trailers, Campers, 5th Wheel",1043,2019-10-31,29167
98274,133.3641383380276,Musical Instruments,"GraphTech PS816300 TUSQ Electric Guitar Saddle, 3 Barrel Tele",3020,2019-10-31,32146
98275,987.942025762366,PC,"K800 Wireless Illuminated Keyboard, Black",1287,2019-10-31,46759
98276,26.754657913004824,Outdoors,Coleman Dual Action Hand Pump,2119,2019-10-31,35751
98277,661.9154050804206,Electronics,"Acrylic 'n' Shaped Headphones Stand / Headset Holder / Desk Display Hanger, Fit ATH, Bose QC3, QC2, QC15, AE2, AKG, Beats Studio, Solo, Wireless, Pro, Sennheiser, Parrot Zik, Panasonic, Sony, Logitech DJ, Professional Gaming and Many Earphones",1747,2019-10-31,12791
98278,392.3099672719161,Camera,Nikon 55-200mm f/4-5.6G ED IF Auto Focus-S DX VR [Vibration Reduction] Nikkor Zoom Lens,3124,2019-10-31,49212
98279,749.3213651792838,Apparel,Slip In Eyeglasses Pouch and Reader Pouch Collection | for Small Medium & Large frames | Pack of Pouches + Microfiber Drawstring pouch + premium eyeglasses Cleaning Cloth |,2476,2019-10-31,47701
98280,364.20089277689215,Major Appliances,GE PVM9179SFSS Profile 1.7 Cu. Ft. Stainless Steel Over-the-Range Microwave - Convection,2222,2019-10-31,101
98281,587.7146329323086,Digital_Music_Purchase,Alma Vieja,1132,2019-10-31,30985
98282,697.6989700035857,Music,Albino,2118,2019-10-31,20477
98283,598.9956502256287,Mobile_Apps,Candy Crush Saga,2172,2019-10-31,17962
98284,112.58448638181638,Apparel,PattyBoutik Women's Sequins One Shoulder Fringe Top,3485,2019-10-31,14124
98285,671.5059786900615,Musical Instruments,Samson Go Mic Portable USB Condenser Microphone,2689,2019-10-31,49010
98286,67.11359557603171,Digital_Video_Games,Acropolis [Download],1374,2019-10-31,31060
98287,451.6035828328959,Major Appliances,Danby DCR88BLDD 3.2 Cu. Ft. Designer Compact Refrigerator - Black,1483,2019-10-31,11084
98288,747.965041175807,Music,The Heat,1608,2019-10-31,15324
98289,416.8130664208378,Furniture,"SilverRest Sleep Shop Therapeutic 12-Inch Memory Foam Mattress, Queen Size",1177,2019-10-31,19541
98290,872.5607023929762,Office Products,"Mead Académie Spiral Sketchbook / Sketch Pad, Mediumweight Paper, 70 Sheets, 11 x 8.5 Inch Sheet Size (54062)",2948,2019-10-31,41738
98291,399.5294546581985,Furniture,VHC Brands Burgundy Tan Jute Oval Stencil Stars Rug,2090,2019-10-31,49918
98292,502.00647632369464,Digital_Video_Games,Castle of Illusion (Relaunch) [Online Game Code],2891,2019-10-31,3001
98293,892.9112100569804,PC,Patriot Signature Flash MicroSDXC with USB Reader and Adapter,3183,2019-10-31,10720
98294,733.0265617307899,Music,Rooms By the Hour,1158,2019-10-31,36997
98295,128.56684741331438,Mobile_Apps,Flashlight: LED Light for Android,3557,2019-10-31,3932
98296,567.6400476414979,Gift Card,Amazon eGift Card - What I Love About Us (Animated) [American Greetings],3125,2019-10-31,9921
98297,30.405192717383358,Furniture,South Shore Annexe Work Table and Storage Unit Combo,1111,2019-10-31,2083
98298,414.00974927067665,Apparel,"Elowel Girls ""Snowman"" 2 Piece Pajama Set 100% Cotton - Infant, Toddler & Kids",2180,2019-10-31,22862
98299,353.6932244304781,Apparel,ELLAZHU Baggy Genie Harem Hippie Hip-hop Capri Short Pants Trouser Onesize GY02,2688,2019-10-31,19376
98300,806.1621156569289,Mobile_Apps,Lost Bubble,3577,2019-10-31,10744
98301,116.58444320199494,Books,Solar Flare: A Novel,2070,2019-10-31,8133
98302,880.072424430647,Automotive,Classic Accessories QuadGear ATV Storage Cover,1378,2019-10-31,39732
98303,480.6958764454967,Grocery,"Special Shit Seasoning Sampler 9oz -13oz Container (Pack of 6 with 1 each of Bull, Chicken, Good, AW & 2 Special)",2075,2019-10-31,28988
98304,172.96255827266847,Books,The 2nd Ave Deli Cookbook: Recipes and Memories from Abe Lebewohl's Legendary Kitchen,2841,2019-10-31,39937
98305,473.6732099619261,Digital_Ebook_Purchase,Backstage Passes and Backstabbing Bastards,3422,2019-10-31,18727
98306,412.42346484017423,Outdoors,Mosquito Net,1299,2019-10-31,43961
98307,459.8910361755241,PC,"Kindle Paperwhite 3G, 6"" High Resolution Display with Built-in Light, Free 3G + Wi-Fi [Previous Generation]",1566,2019-10-31,11706
98308,894.754379637347,Beauty,Nair Brazilian Spa Clay Sensitive Formula Face Cream Hair Remover 0.69 oz,2031,2019-10-31,10006
98309,308.9091205004122,Outdoors,"Planet Bike Blinky ""3"" 3-Led Rear Bicycle Light",3046,2019-10-31,27789
98310,800.5710597566775,Electronics,Abco Tech Water Resistant Wireless tooth Speaker with Suction Cup & Hands-Free Speakerphone,2675,2019-10-31,5468
98311,507.3605260781228,Outdoors,Giro Flak Multi-Sport Helmet,2129,2019-10-31,39660
98312,646.392093642391,Major Appliances,American Aldes Dryer Lint Trap,1552,2019-10-31,39329
98313,944.5864827491856,Digital_Ebook_Purchase,The Bell Jar,1914,2019-10-31,40757
98314,66.89770868106444,Mobile_Electronics,Possbay Black Stitched Automotive Motorsport Manual Stick Shift Knob Black Leather,1799,2019-10-31,28103
98315,522.4888010987876,Music,Unleashed in the East,2183,2019-10-31,33423
98316,182.33798032654613,Books,"Dragons of Summer Flame (Dragonlance Chronicles, Volume 4)",3365,2019-10-31,7800
98317,731.6382639564226,Digital_Music_Purchase,L.A. Noire Official Soundtrack,1500,2019-10-31,49472
98318,824.0736626433641,Mobile_Electronics,Pioneer GM-D8601 Class D Mono Amplifier with Wired Bass Boost Remote,1072,2019-10-31,41002
98319,142.6063122411538,Major Appliances,Kenmore Dryer Timer 8299779 A,2177,2019-10-31,18354
98320,965.4316320501491,Camera,CowboyStudio Photography 9 feet Professional Heavy Duty Light Stand for Photography and Video Lighting,1149,2019-10-31,35561
98321,941.5791158488257,Musical Instruments,Musician's Gear Heavy-Duty Folding Music Stand,2388,2019-10-31,28701
98322,128.1308620041027,Automotive,Camco Residential Water Heater Element Wrench,3286,2019-10-31,7504
98323,551.4210646083734,Grocery,"Organic, Sprouted Flax Flour, Non-GMO, Bio-Available with a Great Taste (16 oz) - Pack of 2",1683,2019-10-31,9357
98324,246.79220388859483,Outdoors,Zippo Matte Lighters,1384,2019-10-31,47358
98325,818.1415806386264,Mobile_Apps,"DoubleU Casino - Vegas Fun Free Slots, Video Poker & Bonuses! Spin & Hit the Jackpot!",1648,2019-10-31,30831
98326,96.62775447421303,Books,The Ferry Woman: A Novel of the Mountain Meadows Massacre,2654,2019-10-31,14064
98327,669.9486853951539,Apparel,Adult Blonde with Brown Surfer Dude Costume Wig,1489,2019-10-31,6380
98328,975.5728603273654,PC,RAVPower AC Portable Charger 27000mAh 100W Built-in AC Outlet Universal Power Bank - White,2451,2019-10-31,38451
98329,316.7583681380618,Baby,"Guidecraft Natural Wooden Doll Buggy - Fits 18"" American Girl Dolls G98106",1201,2019-10-31,9848
98330,650.4729535734608,Books,A Woman's Walk with God: Growing in the Fruit of the Spirit,2474,2019-10-31,41571
98331,501.48978785299533,Grocery,"Cinnabon Classic Cinnamon Roll Coffee Keurig Single-Serve K-Cup Pods, 24 Count",2379,2019-10-31,46253
98332,79.2725288531278,Digital_Video_Download,The Island: Ireland from the Air,2628,2019-10-31,7833
98333,750.8537844265145,Apparel,Gold Toe Big Girls'  3 Pack Dressy Turn Cuff socks,2346,2019-10-31,26693
98334,599.6694039284938,Digital_Music_Purchase,Learn & Burn,1369,2019-10-31,29167
98335,854.7227278706323,Baby,Dr. Brown's Formula Mixing Pitcher,1065,2019-10-31,48598
98336,576.2530024295784,Office Products,"HP 304A (CC530AD) Black Original LaserJet Toner Cartridge, 2 Toner Cartridges",1808,2019-10-31,43816
98337,837.332656513736,PC,Topa Magnetic Leather Smart Cover Case Stand Cover For Apple Ipad 2/3/4 Ipad 5/Air Ipad Mini with Hard Back Case & Screen Protector & Cleaning Cloth & Stylus Touch Pen with Automatic Wake / Sleep Function,1598,2019-10-31,29466
98338,821.3663343450503,Apparel,Charm Your Prince Women's Sleeveless Summer Sun Dress,3049,2019-10-31,31445
98339,905.2787883432815,Automotive,F2P Technologies Garage Door Opener - AC Adapter 101301,2872,2019-10-31,7525
98340,527.1163821138421,Office Products,"Silver Mini 60X Microscope Loupe LED Lighted Magnifier Jeweler Maps, Newspapers, Directories, Legal Documents, Coins, Stamps and Antiques",3237,2019-10-31,42378
98341,234.8436924178555,Camera,"Nikon Coolpix Leather Case for S5100, S4000, S3000, S570 and S70 Digital Cameras (5811, 5810)",3604,2019-10-31,30064
98342,64.69483664665876,Mobile_Apps,Toddler Kids Puzzles PUZZINGO – Learning Puzzle Games,2041,2019-10-31,44673
98343,528.1973342023167,Mobile_Apps,Xtreme Motocross!,3459,2019-10-31,10835
98344,796.8120399734955,Beauty,Vidal Sassoon VS547 1875W Tourmaline Ceramic Hair Dryer,1840,2019-10-31,46082
98345,471.2131828910249,Apparel,Tommy Hilfiger Men's Leather Cambridge Passcase Wallet with Removable Card Holder,2094,2019-10-31,39410
98346,300.21781276101706,Baby,Munchkin Safe Step Gate with TripGuard,1600,2019-10-31,3901
98347,155.3403470102276,Music,Ironman,2834,2019-10-31,17106
98348,333.42272935600846,Camera,4-Pack DSLR & SLR Cheatsheets. Pocket sized quick reference cards. Complete series for use with Canon Rebel XT XTi XS XSi T1i T2i T3 T3i T4i T5 T5i T6 T6i T6s,2902,2019-10-31,45536
98349,211.57169517923944,Health & Personal Care,Thank You Potpourri - 36 Thank You Cards - 6 Designs - Blank Cards - Gray Envelopes Included,2914,2019-10-31,15366
98350,869.820187489799,Digital_Ebook_Purchase,Marjorie Morningstar,3350,2019-10-31,27903
98351,46.196640234130406,Apparel,Soyagift Ladies Headwear Pineapple pattern Wide Rim Flat top fishing Bucket Hat,3429,2019-10-31,33351
98352,238.16201126985908,Camera,Lowepro S&F Transport Duffle Backpack,1735,2019-10-31,41885
98353,618.7035597634427,Music,Strange Angels,1955,2019-10-31,28138
98354,107.44939187568897,Outdoors,Brunton Ball Compass; Pin-on Luminescent #9067,1533,2019-10-31,44986
98355,470.4695334064366,Digital_Ebook_Purchase,"Lean In: Women, Work, and the Will to Lead",2565,2019-10-31,49544
98356,201.23043944367788,Major Appliances,"GE ZDWC240NBS 24 Wine Chiller, 57-Bottle Capacity",2543,2019-10-31,10189
98357,734.277612588207,PC,TNP USB 3.0 SuperSpeed All-in-1 Multi Memory Card Reader for Compact Flash/ Micro SD / SD/ CF / XD / M2 / MS Cards with USB 3.0 Cable Black/Silver,2924,2019-10-31,3493
98358,923.598844315699,Digital_Ebook_Purchase,Blind Dating: A Light-Hearted Romantic Comedy,2570,2019-10-31,4967
98359,813.6597133945882,Video DVD,Dr. Seuss' How The Grinch Stole Christmas (Blu-ray Combo Pack (Blu-ray + DVD)),1702,2019-10-31,45396
98360,656.5261248591557,Musical Instruments,Yamaha SB79C Silent Brass System for Trumpet,1999,2019-10-31,22533
98361,327.2985477202054,Digital_Video_Games,Mortal Kombat Komplete Edition,3126,2019-10-31,30084
98362,664.1200641681157,Health & Personal Care,"NatureWise CLA 1250 Softgels, 1000 mg",1618,2019-10-31,44717
98363,618.6184851650485,Major Appliances,"NewAir WCD-210BK Hot and Cold Water Dispenser, Black",2253,2019-10-31,31503
98364,924.1761837702905,PC,AmazonBasics Cat-5e Network Ethernet Cable,2818,2019-10-31,849
98365,73.73194922183576,Mobile_Electronics,CREE Q5 LED Flashlight Torch w/ Holster Super Bright!,3539,2019-10-31,28120
98366,586.3941640233555,Automotive,CJ Industries F-1 Fantastic Ice Scraper with Brass Blade Red,1056,2019-10-31,42055
98367,169.6316963291419,Baby,The First Years 3-In-1 Potty System,3570,2019-10-31,8692
98368,748.7027270696665,Outdoors,"Slumberjack Tour Lite Synthetic +60 Sleeping Bag, Regular",3036,2019-10-31,28684
98369,506.5187118872602,Baby,"Safety 1st LiteWave Travel System, Mesa",2203,2019-10-31,1149
98370,978.7341894600113,Health & Personal Care,Prodigy Autocode Talking Blood Glucose Monitoring Meter Kit,1963,2019-10-31,9343
98371,11.365464940932315,Digital_Music_Purchase,You Can Do Magic,3481,2019-10-31,22167
98372,344.3225273695822,Major Appliances,uxcell® Home Clothes Socks Plastic Round Airing Hanger 8 Clamps Pink,1153,2019-10-31,26998
98373,849.6166061267347,Mobile_Electronics,An0207swxxx 5v Car Charger for Original Magellan GPS Vehicle Power Adapter/cable,2165,2019-10-31,17823
98374,465.0822222060391,Baby,Baby Trend Activity Walker,2937,2019-10-31,21025
98375,819.8529062987453,Apparel,(GD132) TheLees Mens Slim Fit Collar Point Button Cardigan,1400,2019-10-31,16286
98376,616.6979893198579,Apparel,Dockers Men's Signature Khaki Big and Tall Pleated Pant,1692,2019-10-31,27267
98377,90.3453517645687,Health & Personal Care,Just Pure Hut Dentist Teeth Whitening Pen Kit - Zero Peroxide - Plus Hollywood Dentist Tips - Plus Weight Loss Tips (ebooks),3124,2019-10-31,23235
98378,566.4477974780316,Baby,Prince Lionheart playMAT,3489,2019-10-31,26258
98379,253.10799718769815,Digital_Music_Purchase,Cuculand,2039,2019-10-31,46745
98380,670.7785741344553,Camera,Dolica Proline Tripod,3250,2019-10-31,30108
98381,905.4208239125478,Camera,Fujifilm FinePix S4000 14 MP Digital Camera with Fujinon 30x Super Wide Angle Optical Zoom Lens and 3-Inch LCD,1116,2019-10-31,33681
98382,294.86299199929243,Gift Card,Amazon eGift Card - 21st Birthday (Wine),1915,2019-10-31,11334
98383,176.99375084710113,Electronics,Stereo Wi-Fi Music System,1390,2019-10-31,48274
98384,531.1338859808377,Health & Personal Care,"PureGuardian 12.5L Output per Day Ultrasonic Warm and Cool Mist Humidifier, Large Room, Home, Office, Bedroom, Extended Reach,Easy Quiet Operation, Night Light, Timer, Auto Shut-Off, Pure Guardian H7500",1385,2019-10-31,142
98385,399.1718675178951,Automotive,CIPA Universal Low-Mount Side Mirror Replacement Head,2340,2019-10-31,2666
98386,784.1385416511199,Music,Pacini - Maria Regina d'Inghilterra / Miricioiu · Ford · Plazas · Fardilha · A. Miles · PO · Parry,1862,2019-10-31,7153
98387,66.69181116173951,Baby,"Carters Easy Fit Jersey Portable Crib Fitted Sheet, Blue (Discontinued by Manufacturer)",2571,2019-10-31,23768
98388,246.21733828891698,Apparel,WearAll Womens Plus Size Short Sleeve Button Open Cardigan Womens Stretch Top,2270,2019-10-31,12958
98389,506.60569070796424,Mobile_Apps,Bejeweled 2,2423,2019-10-31,27021
98390,829.0669538295986,Digital_Ebook_Purchase,The Girl with No Name: The Incredible Story of a Child Raised by Monkeys,1445,2019-10-31,29402
98391,338.61881123214215,Musical Instruments,Catalinbread Octapussy Dynamic Octafuzz Pedal w/ 3 Guitar Cables,1806,2019-10-31,4358
98392,93.32630893850374,Health & Personal Care,"Medline Crutch Tips, Grey, Large",1091,2019-10-31,47921
98393,455.1558294539132,Baby,"Kate Aspen Rose Ball Candle in Gift Box with Matching Bow and Tag, White (Discontinued by Manufacturer)",3510,2019-10-31,16104
