sale_id,sales_amount,product_category,product_name,location_id,date,customer_id
70581,64.23299165292565,Outdoors,Knog Frog Strobe Ft+Rr Twinpack,2343,2019-04-26,25450
70582,376.69157561164985,Digital_Video_Games,Witch's Pranks: Frog's Fortune (Premium Edition) [Download],1574,2019-04-26,35002
70583,506.82945896767006,Mobile_Electronics,"IVX-12 V2 D2 - Skar Audio 12"" Dual 2-Ohm IVX Series Subwoofer",3371,2019-04-26,21790
70584,819.1997306448303,PC,Buffalo LinkStation 410 2 TB High Performance NAS Personal Cloud Storage and Media Server,3599,2019-04-26,19717
70585,745.9569189987259,Music,Rituals of Life,2025,2019-04-26,33773
70586,860.5654106640542,Digital_Music_Purchase,Were you there,1094,2019-04-26,38814
70587,452.63209663589214,Camera,Wasabi Power Battery for Panasonic NCA-YN101G,2860,2019-04-26,22408
70588,780.682166564485,Music,Riverside,3539,2019-04-26,25093
70589,582.3990956273431,Camera,Panasonic BL-C230A Wireless Internet Security Camera,3427,2019-04-26,4574
70590,548.2065420779132,Apparel,Inlscp Women's Stylish Fashion Lace Embroidery Straight Fit Pants Black,1181,2019-04-26,46583
70591,811.1999436580331,Beauty,"FULL SIZE RUBBER BASE STYLER,colors vary",1123,2019-04-26,15514
70592,800.9055798836946,Beauty,Conair 1875 Watt Tourmaline Ceramic Hair Dryer,1980,2019-04-26,11079
70593,412.2684635083268,Digital_Ebook_Purchase,La Questione di Amore/The Question of Love  (An Italian/English Dual Language Story),1753,2019-04-26,12981
70594,276.92278517403196,Health & Personal Care,ShowerBreeze - Water Jet Dental Irrigator - Treat Gum Disease Naturally - Stop Bleeding Gums,1594,2019-04-26,2515
70595,746.2288466820279,Digital_Ebook_Purchase,Binary Cycle: Disruption (Binary Cycle Saga Book 1),1866,2019-04-26,40975
70596,505.7219223422639,Furniture,"Crown Mark Iris Vanity Table/Stool, Espresso Finish with Beige Seat",2217,2019-04-26,46517
70597,156.6067819893568,Apparel,U.S. Polo Assn. Junior's Self-Tie Puffer Jacket with Faux Fur-Trimmed Hood,3579,2019-04-26,36243
70598,498.163638486555,Mobile_Apps,Grim Legends: The Forsaken Bride,1609,2019-04-26,37147
70599,432.8051582832475,Office Products,"Learning Resources Answer Buzzers, Set of 4",1615,2019-04-26,40813
70600,304.2539922737226,Digital_Ebook_Purchase,Cry Baby,2444,2019-04-26,23628
70601,581.3602648998798,Apparel,Glamorise Women's Full Figure Cotton Blend Support Bra #1001,2553,2019-04-26,2457
70602,747.3099008762566,Electronics,TONSEE Brand New Quartz Clock Movement Mechanism with Hook DIY Repair Parts + Hands,2171,2019-04-26,42188
70603,153.1851494673294,Office Products,Personalized Stainless Steel Money Clip Free Engraving,2481,2019-04-26,32571
70604,876.4159496818133,Digital_Ebook_Purchase,The Innocent (Will Robie Book 1),2735,2019-04-26,11903
70605,756.5538235132224,Outdoors,Kent Mini 8 Folding Bike,2375,2019-04-26,39449
70606,744.2363491434129,Health & Personal Care,Protein Milkshake Vanilla Protein Powder,2361,2019-04-26,11346
70607,368.5444083081303,Baby,Clay Hand & Footprint Photo Keepsake Desktop Frame,1843,2019-04-26,23007
70608,11.444928371945887,Furniture,Night Therapy Platform Metal Bed Frame/Foundation Se,2564,2019-04-26,3481
70609,239.82587640966423,Outdoors,Shimano Alivio M411 Hybrid Crankset (Black),2344,2019-04-26,32948
70610,193.48897474476374,Digital_Video_Download,I Married a Monster from Outer Space,2715,2019-04-26,993
70611,47.12286537710696,Beauty,Tangle Teezer Salon Elite Hair Brush,2555,2019-04-26,10333
70612,605.0963541256757,Apparel,Van Heusen Men's Fitted Long Sleeve Wrinkle Free Satin Stripe Shirt,2166,2019-04-26,33263
70613,20.03927137083791,Outdoors,ShelterLogic 3-in-1 White Canopy with Enclosure and Extension Kit,2145,2019-04-26,38109
70614,396.5076081843435,Music,Crock of Gold,2720,2019-04-26,29107
70615,407.69025333539287,Music,First of the Microbe Hunters,1247,2019-04-26,26372
70616,355.7333977401076,Furniture,Winsome Wood 3-Panel Wood Folding Screen,1344,2019-04-26,49844
70617,201.33300232121601,Beauty,Panasonic Single Blade Wet/Dry Travel Shaver 1 ea,2739,2019-04-26,9355
70618,505.8864816576538,Digital_Ebook_Purchase,Dark Places: A Novel,1428,2019-04-26,28335
70619,994.3212993095219,Digital_Video_Games,The Legend of Korra,2611,2019-04-26,15453
70620,957.6826912445306,Digital_Ebook_Purchase,Dying to Be Thin: A Fat City Mystery,2874,2019-04-26,7804
70621,699.6397536304477,Beauty,Dr Song Remineralization Gel 8 Syringes Teeth Treatment,1614,2019-04-26,39079
70622,395.23292014735864,Digital_Ebook_Purchase,Attachment and Child Development,2293,2019-04-26,39040
70623,396.98213823863193,Grocery,"50-count TOP BRAND COFFEE K-Cup Variety Sampler Pack, Single-Serve Cups for Keurig Brewers",1505,2019-04-26,2514
70624,418.16134754187794,Office Products,"Universal Double Window Business Envelope, #9, White, Pack of 50",2058,2019-04-26,49019
70625,958.9124819707301,Books,Clanbook: Lasombra,1900,2019-04-26,34133
70626,635.8247875967396,Apparel,Women's Sun Drop Headband and Leg Warmers Set,1071,2019-04-26,13453
70627,460.95932662333365,Mobile_Apps,8 Ball Pool,2037,2019-04-26,6549
70628,997.1690603065105,Camera,"Albinar Lens Mount Adapter for Canon FD/FL Lens to Canon EOS EF Body with Infinity Focus, made in Japan",1944,2019-04-26,29378
70629,160.7731375164587,Digital_Ebook_Purchase,Getting the Most Out of Your Homeschool This Summer:  Learning Just for the Fun of it! (The HomeScholar's Coffee Break Book series 7),1963,2019-04-26,2466
70630,848.3025842593785,PC,"Kindle Fire HDX 7"", HDX Display (Previous Generation - 3rd)",2526,2019-04-26,2213
70631,910.441424743269,Digital_Video_Games,Alone In The Dark 4: The New Nightmare [Download],1091,2019-04-26,49540
70632,446.6340592192282,Mobile_Apps,Halloween Drops - Match three puzzle,3510,2019-04-26,39470
70633,308.23717717512284,Musical Instruments,"Hosa ACD-477 Universal Power Adaptor, Selectable up to 12 VDC 1200 mA",2239,2019-04-26,37300
70634,310.69797740780035,Music,Flesh and Blood,1180,2019-04-26,45582
70635,897.4785038461697,Camera,Kodak Zi8 Pocket Video Camcorder - Raspberry - REFURBISHED,2276,2019-04-26,37849
70636,838.0764287341002,PC,"Deep Sonar 100 AC Powered 2.0 Speakers for Desktop PC, Notebook, Tablet and Smartphone",1983,2019-04-26,6128
70637,635.6404124419131,Mobile_Apps,Reaper,2457,2019-04-26,31561
70638,842.9282540113368,Grocery,"CB's Nuts Unsalted Peanuts, 12 Ounce",3154,2019-04-26,19006
70639,165.0191968548603,Apparel,Kangaroo Black Hat,3606,2019-04-26,11906
70640,230.0591134703735,Electronics,PORTTA Auto-Switching 3-Port HDMI2,2365,2019-04-26,8011
70641,263.7216866482441,Apparel,DKNY Fusion Custom Fit Wirefree Bra (456178),3085,2019-04-26,31310
70642,299.9081202501761,Digital_Video_Games,Darksiders II,3370,2019-04-26,19341
70643,770.1857615232462,Apparel,8 Love Note Collar Stays in a Nice Gift Box,1333,2019-04-26,9643
70644,981.5743963519737,Digital_Video_Games,Jewel Quest Solitaire [Download],3600,2019-04-26,17190
70645,255.85506141756332,Outdoors,Smith Optics Serpico Sunglasses,3424,2019-04-26,42411
70646,646.8395490123461,Mobile_Apps,"Best Holy Bible! Study Words from Jesus Christ Calling to You & Me! Download Mass Prayers & Blessings Daily, Verses of the Day, Devotionals, Hope Times, Loves and Comfort! A FREE Verse app for Teens, Kids Men & Women Ministry Videos LDS by Topic Apps",3383,2019-04-26,47998
70647,890.1962590728133,Beauty,"Jessica Mc Clintock by Jessica Mcclintock Powder with Puff for Women, 2-Ounce",1593,2019-04-26,35766
70648,298.2772434248685,Baby,"X Wide Wire Mesh Gate, Fits Spaces between 29.5"" to 50"" wide and 32"" high",1846,2019-04-26,6779
70649,925.6853734844597,Major Appliances,"Whirlpool Part Number ER2187172 : Door Bin, Deep",3431,2019-04-26,4846
70650,598.762766706933,Music,Blue Murder,1122,2019-04-26,12664
70651,227.02338320030614,Digital_Video_Download,Earth to Echo,1826,2019-04-26,5312
70652,384.6755969733269,Books,Victoria's Sparkling Web,2855,2019-04-26,36650
70653,272.72003755623484,Apparel,Duofold Men's Mid-Weight Wicking Thermal Pant,2151,2019-04-26,42544
70654,956.3460127105946,Automotive,Bosch P3720 Cabin Filter for select  Buick/ Chevrolet/ Oldsmobile/ Pontiac models,3570,2019-04-26,30983
70655,858.7422491422658,Books,Robo sapiens: Evolution of a New Species,1474,2019-04-26,29579
70656,887.9129749166602,Digital_Music_Purchase,Smetana: The Bartered Bride,1407,2019-04-26,28330
70657,248.44404170870132,Music,Center Stage (2000 Film),2950,2019-04-26,43678
70658,783.0364053884737,Furniture,"Flaming June Poster Poster Print by Frederick Leighton, 24x36",2092,2019-04-26,33568
70659,172.5689323456345,Electronics,"LapWorks 15"" Heavy Duty Swivel With No-Slip Pad and Steel Ball Bearings - LIFETIME WARRANTY - for Indoor/Outdoor Use With Flat Panel Monitors and Big Screen Tv's",1431,2019-04-26,20283
70660,15.137400637909598,Electronics,RCA ANT1650F Flat Digital Amplified Indoor TV Antenna,2258,2019-04-26,47651
70661,219.6589214282054,Mobile_Electronics,Sienoc Mini Spy Vehicle Real time Tracker For GSM GPRS GPS System Tracking Device TK102 Color Black,1188,2019-04-26,570
70662,914.0043450794172,Automotive,"SiliKroil Penetrating Solvent, 10 oz. aerosol (SILIKROIL)",1499,2019-04-26,32065
70663,60.36110634640753,Furniture,"9’x12’ Taffy Apple Area Rug Carpet. MULTIPLE SIZES, SHAPES and COLORS TO CHOOSE FROM. Home area rugs, runner, rectangle, square, oval and round. Hem-stitching on all four sides. 22 oz. Face Weight. 1/2"" Thick. Polyester. Loose and Soft Frieze.",1806,2019-04-26,38329
70664,413.2148199352768,Music,The Sickness,1098,2019-04-26,35993
70665,166.42583247082675,Digital_Video_Download,Meet the Fockers,1942,2019-04-26,1482
70666,260.00706719652527,Grocery,Kirkland Signature Macadamia Clusters,1580,2019-04-26,45907
70667,818.2109555089615,Automotive,CURT 11469 Class 1 Trailer Hitch,2783,2019-04-26,49932
70668,88.44504228871783,Office Products,"Slip-N-Snip The Original Folding Safety Scissors (1, 13 IN)",3569,2019-04-26,23502
70669,148.82528836833038,Beauty,Razorba Back Hair Shaver,3337,2019-04-26,33213
70670,302.27797703708484,Electronics,Monster NCredible NTune On-Ear Headphones,2090,2019-04-26,24369
70671,326.4191798865771,Musical Instruments,"Williams Sound MIC 014-R plug Mount Microphone; Can be used with PockeTalker, DigiWave DLT transceivers or T2863 FM Transmitter; 3.5mm mono plug; Omnidirectional condenser",2187,2019-04-26,34820
70672,79.56454189532873,Books,The Natural (Perennial Classics),1338,2019-04-26,42011
70673,877.0270799724053,Digital_Video_Games,Warhammer 40k: Dawn of War Dark Crusade [Download],3198,2019-04-26,6719
70674,91.3397663174609,Musical Instruments,ADJ Products MEGA FLASH DMX 750 W DMX STROBE,1031,2019-04-26,949
70675,480.2509533751566,Musical Instruments,Fun Central LED Tambourine,1450,2019-04-26,45403
70676,873.758498135026,Digital_Video_Games,Little Shop - City Lights [Download],3027,2019-04-26,12043
70677,129.65675607880502,PC,"Infiland Folio PU Leather Case Smart Fit Cover For 7inch LG G PAD 7.0 V400 / LTE V410 / VK410 / UK410 Tablet Only (7inch LG G PAD 7.0 V400,Purple)",1994,2019-04-26,27746
70678,431.99107791676084,Electronics,"FRiEQ 3.5mm Male To Male Car and Home Stereo Cloth Jacketed Audio Cable (4 Feet/1.2M) for iPhone, iPad, iPod, Smartphones and mp3 players (Plug will be Fully Seated with Phone Case On) Blue/Yellow",2167,2019-04-26,15557
70679,790.1339589826719,Mobile_Apps,WWE,1942,2019-04-26,33529
70680,547.6249886743019,Health & Personal Care,Fiore® 4 Pack Cool Hip Rectangular Reading Glasses Light Weight Spring Hinges,3536,2019-04-26,36013
70681,135.5745259235265,Automotive,Lisle 41900 Pitman Arm Puller,1712,2019-04-26,26137
70682,104.01947836980972,Office Products,"Minitube Preformed Coin Wrappers, Assorted, 500 Count",2903,2019-04-26,24217
70683,390.3076846099281,Digital_Ebook_Purchase,Persistent Love,3546,2019-04-26,8490
70684,480.1411224033406,Baby,green sprouts Fruit Cool Soothing Teether,2746,2019-04-26,36971
70685,503.8522413152122,Automotive,Troy Lee Designs BP 7850-HW Shirt Youth Undergarment Off-Road/Dirt Bike Motorcycle Body Armor - Black / Large,3535,2019-04-26,33807
70686,521.5441094065698,Apparel,Lilly Pulitzer Women's Jupiter Island Tunic,3477,2019-04-26,49210
70687,255.62403982041172,Grocery,Milliard Citric Acid - 2 Pound - 100% Pure Food Grade NON-GMO (2 Pound),2966,2019-04-26,26605
70688,959.8803697249026,Beauty,Laila Ali Ionic Soft Bonnet Dryer,2010,2019-04-26,14236
70689,656.0797357537654,Furniture,Nexera Pinnacle 49-Inches TV Stand,1746,2019-04-26,23859
70690,914.4140925327745,Outdoors,Oasis 2 quart Heavy Duty Canteen PR20CB,3582,2019-04-26,41204
70691,302.5777831563584,Digital_Ebook_Purchase,The Republican: An Irish Civil War Story,2547,2019-04-26,29747
70692,272.071394490741,Camera,"YN Advanced Wireless Radio Remote Release for Nikon D700, D300, D200, D3, D2, D2H, D2Hs, D2X, D1, D1h, D1x SLR Digital Cameras, Range up to 200m",1166,2019-04-26,31184
70693,401.3583568276594,Camera,Panasonic Lumix DMC-TZ5K 9MP Digital Camera with 10x Wide Angle MEGA Optical Image Stabilized Zoom,3440,2019-04-26,46014
70694,419.1021529744253,Digital_Video_Download,The Bling Ring,3410,2019-04-26,2556
70695,245.83914404874503,Digital_Ebook_Purchase,CREATURES OF APPETITE (Emma Kane / Jacob Thorne Book 1),2036,2019-04-26,28788
70696,247.52077062334374,Digital_Music_Purchase,Run To You,1644,2019-04-26,13643
70697,912.1471508126098,Digital_Ebook_Purchase,Mammy Walsh's A-Z of the Walsh Family: A Penguin Special from Viking,1071,2019-04-26,25784
70698,153.73025001898398,Music,Canto Amo Sueno,1719,2019-04-26,44181
70699,520.4100704370749,Apparel,VonFon One-piece flouncing shoulder bikini Ruffles Bathing Suit Swimwear,1830,2019-04-26,9452
70700,322.5507434922322,Digital_Music_Purchase,100 Beats For DJs & MCs,2571,2019-04-26,18883
70701,901.175861411965,Office Products,Lanyard with Soft Rubber Ladybug,2825,2019-04-26,39809
70702,820.8157570751158,Digital_Video_Games,Mahjohng Christmas [Download],1270,2019-04-26,32608
70703,971.0373590757721,Major Appliances,"Washer Pump 2 Hose for Maytag, Magic Chef, 21001906, 21002240, 35-6780",3409,2019-04-26,43857
70704,657.080256302278,Apparel,Sweet Kids Big Girls' Vintage Metallic Lace & Tulle Flower Girl Pageant Dress,2222,2019-04-26,39009
70705,845.7768627812316,Digital_Ebook_Purchase,Operation Drumbeat: Germany's U-Boat Attacks Along the American Coast in World War II,2672,2019-04-26,103
70706,26.336747364281866,Automotive,OTC Stinge Bar-Type Puller/Bearing Separator Set,3171,2019-04-26,2233
70707,724.4619408999791,PC,Acer Aspire One 532h NAV50 all Series P/N: UM09G31 UM09G41 UM09G51 UM09H31 UM09H41 Laptop Battery - Premium Superb Choice® 6-cell Li-ion battery,1008,2019-04-26,20479
70708,546.478384885057,Baby,"Kids Line 9 Piece Crib Bedding Set, Pirate Party",2232,2019-04-26,9053
70709,43.90297784864114,Baby,"Green Sprouts 5 Pack Fashion Waterproof Absorbent Terry Bibs, Boys",1026,2019-04-26,13958
70710,645.5345506570335,Baby,GroVia Snap Diaper Shell System,1802,2019-04-26,30879
70711,471.73952454052903,Digital_Ebook_Purchase,L.A. Candy,2495,2019-04-26,1296
70712,794.037119330822,Furniture,Dorel Home Products Trundle for Daybed,2526,2019-04-26,47327
70713,482.2359542506134,Apparel,Love Lingerie Sexy Off Shoulder Plus-Size Sleepwear G-strings Lingerie Sets,1297,2019-04-26,14866
70714,282.8359792741749,Digital_Ebook_Purchase,Paper Roses (Texas Dreams Book #1): A Novel,2010,2019-04-26,47949
70715,719.9613759399954,Major Appliances,Coolit Systems USB Beverage Chiller,2332,2019-04-26,29791
70716,428.9296065148925,Apparel,Lucky Brand Women's Geo Firework Tee,2412,2019-04-26,16537
70717,660.3659729648999,Apparel,Yoursclothing Plus Size Womens Floral Print Jersey Jumpsuit,2231,2019-04-26,37183
70718,73.325035253176,Major Appliances,Fisher Paykel CMO-24SS-2 24&quot; Convection Microwave Oven with 1.5 cu. ft. Capacity 10 Sensor Cook Settings Convection Removable Turntable and 2 Baking Racks: Stainless,1765,2019-04-26,49074
70719,782.0495982736815,Digital_Music_Purchase,Wrath Of The Gods [Deluxe Edition with Bonus Tracks],2862,2019-04-26,38215
70720,986.9288362384893,Automotive,"NEW 2004-08 OEM F-150 (4 window button, panel, door, lock) Window Master Control Switch Ford (2004 2005 2006 2007 2008 04 05 06 07 08 Drivers side, power, button, four door)",1172,2019-04-26,22277
70721,49.56652319725432,Automotive,Tinkerbell Fairy Vinyl Decal Sticker,3196,2019-04-26,22690
70722,798.5761626956591,Books,The Store,1526,2019-04-26,7272
70723,881.6673851853369,Outdoors,Victorinox SwissTool,1904,2019-04-26,27022
70724,517.9004937820713,Camera,24x36 inch LARGE PRO PHOTO LIGHT SOFT BOX SOFTBOX and SPEED RING,2375,2019-04-26,7771
70725,68.46448430479724,Electronics,"NudeAudio Super-M Portable Wireless Bluetooth Speaker; IPX-5 Waterproof and Sand Proof Rating; High Quality Hand Free Phone Audio; Apple MacBook, iPhone 5, iPhone 6/6s/6 Plus, and Samsung Galaxy, Android Compatible",2496,2019-04-26,20262
70726,308.0958097747298,Baby,"Flower Decor 2"" White Mini X-Small Nylon Mesh Flowers Daisy Daisies 6 Piece Decorations Set Decorate Baby Nursery Bedroom Girls Room Wall Wedding Birthday Party Shower Crafts Scrapbooks Invitations",2079,2019-04-26,29251
70727,472.6498285880068,Books,Close Friends,2297,2019-04-26,10414
70728,991.1288813110917,Digital_Music_Purchase,Dictaphone's Lament,3540,2019-04-26,2709
70729,807.8624200540711,Music,No Strings Attached,1081,2019-04-26,13377
70730,445.11058562343163,Mobile_Electronics,"Dash Mount With Built In Cradle For The TomTom GO 720, 730, 740, 920, 930, 930T, 300, 500, 510, 630, Plus, Receiver GPS Systems",1892,2019-04-26,32706
70731,424.85868642862846,Apparel,Lynyrd Skynyrd - Call Me The Breeze T-Shirt,3004,2019-04-26,41085
70732,410.1759124318307,Digital_Ebook_Purchase,Killing Kennedy: The End of Camelot (Bill O'Reilly's Killing Series),1932,2019-04-26,13775
70733,188.15566149674578,Furniture,Achim Capri 3 Piece Wrought Iron Medallion Indoor Rug Set,1206,2019-04-26,40091
70734,945.0530301819564,Music,Why Does My Heart Feel So Bad,2330,2019-04-26,25494
70735,515.2775911740753,Musical Instruments,[DISCONTINUED] Vox Joe Satriani Satchurator Distortion Pedal,2719,2019-04-26,43633
70736,96.2062036151364,Outdoors,JanSport Elefunk,3045,2019-04-26,47264
70737,869.9625998861767,Grocery,"Post, Great Grains, Raisin, Date & Pecan Cereal, 16oz Box (Pack of 4)",2035,2019-04-26,3252
70738,644.4994999213664,Grocery,Popin' Cookin' DIY Nazonazoneruneru Candy Paste Mix by Kracie,1450,2019-04-26,48073
70739,342.6405192717891,Apparel,ELLAZHU Women Baggy Harem Hippie Hexagram Printing Pants Trouser Onesize GK07,2324,2019-04-26,39242
70740,296.0694665460194,Baby,Medical Records Book - Doctor Visits Records,2483,2019-04-26,5634
70741,907.6023844483155,Automotive,CHEVROLET CAVALIER MIRROR MANUAL LEFT (DRIVER SIDE) (COUPE) 1995-2005,1904,2019-04-26,31072
70742,164.371895297938,Grocery,"Sunny Day Organics Raw Vanilla Bean Powder, 4.23 oz",1672,2019-04-26,6141
70743,117.18792522869427,Digital_Software,Cook'n Recipe Organizer Version 11 PC [Download],2343,2019-04-26,47979
70744,345.06388559973084,Electronics,"GXG-1987 WiFi Wireless OBD-II Mini OBD2 Auto Car Diagnostic Scanner Tool Adapter Reader Scan Code Tester for iPhone 6S 5 iPad4 iPod mini iOS PC Windows, Android Device",2529,2019-04-26,29721
70745,194.58101349395812,Digital_Music_Purchase,All Eyez On Me [Explicit],2658,2019-04-26,19502
70746,68.87552072816673,Office Products,"2014 Switched on Schoolhouse, 10th Grade, Grade 10, Science Curriculum by AOP (Alpha Omega HomeSchooling), SOS CD-ROM",2126,2019-04-26,16651
70747,605.742869626198,Mobile_Electronics,Unisex Blue Kids Student Sports Fashion Watches Alarm Chronograph Long lasting battery Ccutron Wristband,3240,2019-04-26,13167
70748,492.41971814545883,Outdoors,Swiss Gear 10- by 10-Foot Smart Shade Canopy,1793,2019-04-26,29331
70749,744.248725506608,Office Products,6 Reusable Single Cup Keurig Solo Filter Pod Coffee Stainless Mesh Generic,2929,2019-04-26,30600
70750,369.54443445733995,Music,Lost & Found:The Temptations: You've Got To Earn It (1962-1968),1321,2019-04-26,5459
70751,771.8783954995962,Beauty,"Electric Callus Remover and Shaver by Ckeyin - Best Rechargeable Pedicure Foot Care File Tool - Remove Dead, Hard, Cracked Skin and Reduce Calluses on Feet in Just Seconds - Spa Like Results",2750,2019-04-26,8141
70752,677.3381380341398,Digital_Video_Games,Escape Plan: The Asylum DLC - PS4 [Digital Code],3377,2019-04-26,43121
70753,668.2847660668176,Major Appliances,"1 X Dishwasher Rack Roller for Frigidaire, Electrolux 154174501",1241,2019-04-26,645
70754,616.0565114358063,Health & Personal Care,"Cascade Platinum Actionpacs, Fresh Scent, 65 Count",2458,2019-04-26,6957
70755,978.6339097856692,Digital_Ebook_Purchase,The Hob (The Gray Court Book 4),3271,2019-04-26,2665
70756,774.3315412057515,Automotive,Candy Cane DECAL Pack (non-magnetic!),3237,2019-04-26,11262
70757,595.5625317769187,Camera,"Wasabi Power Battery for Panasonic DMW-BCK7, NCA-YN101G and Panasonic Lumix Cameras",3569,2019-04-26,30464
70758,447.7959671941015,Major Appliances,Lg LFX31945ST: Super-Capacity 3 Door French Door Refrigerator with Door-in-Door,3283,2019-04-26,33558
70759,18.203885688969628,Health & Personal Care,Nature's Way Alive! Multivitamin,2819,2019-04-26,40108
70760,385.6682687405306,Electronics,Invisible Clock II - Vibrating Reminder,1541,2019-04-26,44535
70761,390.9586991796832,Office Products,"LD Compatible Xerox Phaser 8560 Black 108R00727, Cyan 108R00723, Magenta 108R00724, & Yellow 108R00725 Ink Sticks",1152,2019-04-26,39077
70762,466.0025915938634,Digital_Video_Games,Crazy Machines 2 with Invaders from Space (Bundle Edition) [Download],1048,2019-04-26,19662
70763,924.8682565672384,Video DVD,Shaun of the Dead,2784,2019-04-26,3462
70764,496.2099721307969,Automotive,Lund 91030 Revelation Seel and Peal Tonneau Cover,2853,2019-04-26,44542
70765,852.6149341994529,Mobile_Electronics,"New Waterproof Shockproof Dirtproof Snowproof Case Box for iPod touch 4th 5th Generation (ipod 5th, Red)",2218,2019-04-26,43381
70766,858.983940038685,Digital_Video_Games,The Last of Us,3478,2019-04-26,49587
70767,770.4654873910494,Outdoors,"Stansport Inflatable Air Mattress with Built-In Pillow, Red/Blue (76- X 29-Inch)",1096,2019-04-26,34811
70768,68.22592518685187,Digital_Ebook_Purchase,Emergence (The Hroza Connection Part 1),2951,2019-04-26,48847
70769,117.09290659226505,Music,The Wiz: Original Soundtrack (1978 Film),3576,2019-04-26,4910
