sale_id,sales_amount,product_category,product_name,location_id,date,customer_id
83258,170.90174934023588,Outdoors,Toy Story Child Pacific Disney Pixar Hardshell Helmet and Pads,2753,2019-07-20,31226
83259,697.4898666905289,Digital_Ebook_Purchase,City of Bones (The Mortal Instruments Book 1),1255,2019-07-20,34096
83260,707.8175695210605,Books,"Write It Down, Make It Happen: Knowing What You Want And Getting It",2328,2019-07-20,43954
83261,746.0695517692566,Books,The House on Garibaldi Street (Classics of Espionage),3486,2019-07-20,26930
83262,725.8815636638697,Digital_Software,PowerDVD 13 Ultra,3543,2019-07-20,33812
83263,586.7479911180003,Electronics,"Ultimate Ears 200vi Noise-Isolating Headset, Blue (Discontinued by Manufacturer)",2573,2019-07-20,29790
83264,90.15059587442715,Baby,Munchkin 36 Bath Letters and Numbers,2822,2019-07-20,22717
83265,199.96423912805434,Mobile_Apps,Sonic The Hedgehog 4 Episode I,1761,2019-07-20,38883
83266,642.4481954290677,Automotive,"The Brite Box with Fog Light Control Model SF8.FLC.5B - Headlight enhancer - Keeps factory fog lights AND low beams ON with high beams. MAKES NIGHT DRIVING SAFER - your lights become high performance lights! Vehicle bulb data: Headlights - 9008, Foglights: 9145.",3321,2019-07-20,3970
83267,24.477218486047832,Grocery,Bumble Bee Sensations Seasoned Tuna Medley,1088,2019-07-20,9404
83268,724.7591031826477,Digital_Music_Purchase,Can't Help But Wait,2819,2019-07-20,26992
83269,516.1349680070778,Outdoors,Park Tool Head-Gear Lockring Wrench HCW17,3355,2019-07-20,44563
83270,848.0133643308909,Musical Instruments,PYLE PCMX270B PA System,1805,2019-07-20,48225
83271,850.9949352185761,Apparel,Because I'm the Director That’s Why Men's Tee Shirt,2584,2019-07-20,29471
83272,620.0013849210104,Office Products,"PlanAhead Organizer,Black",2952,2019-07-20,2110
83273,701.726387512287,Digital_Video_Download,American Crime,2371,2019-07-20,12269
83274,958.601997275869,Musical Instruments,Gibraltar SC-GEMC Electronic Mount Arm With Clamps Pair,1708,2019-07-20,12202
83275,827.3064495072907,Mobile_Electronics,"3 in 1 Charger Kit, Home/Wall/Travel Charger, Car Charger, Retractable USB kit for Apple iPod iTouch iPhone Touch Video Nano Mini Classic",3089,2019-07-20,45903
83276,981.4703782874328,Music,Mark II,2197,2019-07-20,10481
83277,670.0024962662875,Grocery,"Al Dente Carba-Nada Egg Fettuccine, 10-Ounce Bags (Pack of 6)",1947,2019-07-20,13798
83278,533.5282438910292,Outdoors,Schrade Gunstock Trapper Old Timer Folding Knife,1130,2019-07-20,44477
83279,888.5644344310197,Mobile_Electronics,"BESTOPE® Waterproof Wireless Bluetooth Shower Speaker & Hands-Free Speakerphone Compatible with All Bluetooth Devices, Apple iPhone 5/5S/5C Siri and All Android Devices (Blue)",2993,2019-07-20,4193
83280,359.1960594951392,Baby,"Bright Starts Ingenuity Perfect Place High Chair, Bella Vista (Discontinued by Manufacturer)",2948,2019-07-20,32339
83281,141.74557441248618,Outdoors,M-Wave Bicycle Pannier Bags,3393,2019-07-20,16033
83282,808.8986414037581,Apparel,Ralph Lauren Baseball Large Pony,3428,2019-07-20,35586
83283,527.1937495036437,Electronics,Sony Stamina Platinum Alkaline AA Batteries (4-Pack),2734,2019-07-20,43036
83284,604.3955831293804,Baby,BABYBJORN Potty Chair,1049,2019-07-20,40810
83285,887.8098132105578,Office Products,"Floortex Ultimat Polycarbonate Chair Mat for Carpets up to 1/2""",2350,2019-07-20,27986
83286,121.13826259579248,Outdoors,Novelty Push Button Folding Pocket Comb,1992,2019-07-20,34998
83287,239.159306127647,Mobile_Electronics,Wireless Lifter & EHS Cables EHS Cable APP-5 38438-01 (Polycom) for CS50 ¨C CS361,2910,2019-07-20,13115
83288,156.45298135004842,Office Products,HP 61 Tri-color Original Ink Cartridge (CH562WN),1576,2019-07-20,27882
83289,610.2229594324646,Health & Personal Care,"Ivog Pedi-Luv 200 Powerful Callus Remover Rechargeable Professional Pedicure Device, Includes 4 Rollers (2 Coarse & 2 Extra Coarse)",3040,2019-07-20,21212
83290,699.6921110648123,Mobile_Electronics,Navitech Black Faux Leather Case Cover For the Nook Simple Touch/ Nook Simple Touch with GlowLight,2660,2019-07-20,16161
83291,607.1514796070597,Books,Final Warning,2292,2019-07-20,26741
83292,63.69972761933066,PC,ArmorSuit MilitaryShield Skin Protector Shield Full Body for Apple iPad 2 + Lifetime Replacements,2462,2019-07-20,8757
83293,825.9212630497939,Musical Instruments,New Drum Set Black 5-Piece Complete Full Size with Cymbals Stands Stool Sticks,2622,2019-07-20,44278
83294,142.31550350214658,Major Appliances,279816 Thermostat Kit for WHIRLPOOL Dryer,2472,2019-07-20,46376
83295,847.1473473586387,Mobile_Electronics,"GOgroove BlueSYNC MCX Bluetooth Speaker System with USB Charging &amp; Premium 2.1 Channel Sound - Perfect for College Dorm Rooms , Student Classrooms and Teacher's Offices **Includes Accessory Bag**",2240,2019-07-20,2459
83296,734.7292905906743,Health & Personal Care,"Automatic Digital Wrist Blood Pressure Cuff Monitor with Portable Case by LotFancy, Irregular Heart Rate Detector, 4-User Mode, Large LCD Display, FDA Approved, Perfect Device for Home Use",3525,2019-07-20,812
83297,604.767472560641,Digital_Ebook_Purchase,Marjorie Morningstar,2198,2019-07-20,45057
83298,316.5813844343077,Music,Diesel and Dust,2407,2019-07-20,21839
83299,722.7834897301065,Digital_Music_Purchase,Superfiction,2684,2019-07-20,35595
83300,992.7350181924326,Digital_Video_Games,Company of Heroes Complete: Campaign Edition [Download],1711,2019-07-20,16267
83301,455.44036096364954,Office Products,Texas Instruments TI84 Plus C Silver Edition,2937,2019-07-20,44841
83302,195.44649238869403,Baby,Classic Pooh: Piglet Plush,3234,2019-07-20,18758
83303,264.1970535703343,Major Appliances,AKDY Freestanding Wine Cooler,3108,2019-07-20,31886
83304,680.7686880010484,Camera,ENEL12 Battery Charger AC/DC Single for Nikon EN-EL12 MH-65 Coolpix AW120 AW300 AW300s P300 P310 P330 P340 S31 S6000 S610 S6100 S610C S6150 S6200 S8100 S8200 S9100 S9200 S9300 S9400 S9500 S9900s,2042,2019-07-20,27651
83305,675.030949949832,Major Appliances,"Bosch SHX3AR7 24"" Built-In Dishwasher with Bar Handle and Express Wash - Ascenta,",1692,2019-07-20,35895
83306,689.8712385368284,Furniture,"Rolland Extra Large Office Chair Caster for Hardwood Floor - 3""(75mm) Wheel - 7/16""(11mm) Stem - Compatible with most chairs including Herman Miller",1341,2019-07-20,47304
83307,439.97471985147155,Camera,"Polaroid CIM-1237R 12 MP Digital Camera with 3x Optical Zoom, Red",1399,2019-07-20,25016
83308,615.6797083626616,Digital_Ebook_Purchase,"Kosher Chinese: Living, Teaching, and Eating with China's Other Billion",2081,2019-07-20,24150
83309,869.4262720887662,Digital_Video_Games,IL-2 Sturmovik: Cliffs of Dover,1374,2019-07-20,9778
83310,642.0489322757321,Digital_Music_Purchase,"1% For The Planet, The Music (Vol. 1)",2460,2019-07-20,17571
83311,914.016200679963,Music,Evolver,1933,2019-07-20,30851
83312,756.6880162192625,Digital_Software,Wondershare Video Converter Pro for Mac [Download],1467,2019-07-20,18220
83313,887.7402917826014,Mobile_Electronics,Flowers World Amsterdam The Netherlands Amazon Kindle Fire HD 8.9 [2012 Version] Flip Case Stand Magnetic Cover Open Ports Customized Made to Order Support Ready Premium Deluxe Pu Leather 9 13/16 Inch (250mm) X 6 7/8 Inch (175mm) X 11/16 Inch (17mm) Liil Professional Kindle_fire Cases Kindle8.9 Accessories Build Model Graphic Background Covers Designed Model Folio Sleeve HD Template Designed Wallp,3145,2019-07-20,24056
83314,832.6597116506905,Mobile_Apps,Flashlight: LED Light for Android,3211,2019-07-20,48419
83315,651.6921877897902,Books,Ottolenghi: The Cookbook,1430,2019-07-20,10644
83316,783.565192509401,Books,Ghost of a Smile: Stories,1575,2019-07-20,11634
83317,262.1096809544292,Books,Forever Free,2989,2019-07-20,5853
83318,439.995987550489,Digital_Software,McAfee 2015 Antivirus Plus 1 PC,1753,2019-07-20,15616
83319,372.6635010074414,Books,Mielziner: Master of Modern Stage Design,1091,2019-07-20,38765
83320,72.97192330639967,Digital_Video_Download,Supernatural: The Complete Tenth Season,2019,2019-07-20,42101
83321,47.98308351366262,Digital_Video_Download,Top Five,2937,2019-07-20,7976
83322,466.4672213227414,Apparel,Lacoste Mens GLC Cotton Color Block Crew Neck Sweater,1960,2019-07-20,13281
83323,599.8361102860249,Apparel,Tommy Hilfiger Mens Classic Tommy Briefs 3 Pack,2295,2019-07-20,37051
83324,62.64240575220046,Furniture,Dexter Metal Headboard with Decorative Castings and Globe Finials,2075,2019-07-20,19016
83325,883.6710851041967,Apparel,Van Heusen Men's Fitted Long Sleeve Wrinkle Free Satin Stripe Shirt,1688,2019-07-20,15410
83326,116.78023198323741,Digital_Music_Purchase,"Copies, Clones & Replicants",1819,2019-07-20,3843
83327,256.5950236024304,Digital_Video_Games,The Binding Of Isaac: Rebirth - PS4 [Digital Code],2432,2019-07-20,41131
83328,490.8366218951271,Furniture,Joveco Leatherette Button Tufted 360 Degree Swivel Adjustable Chair,3234,2019-07-20,49601
83329,190.10938336489167,Grocery,"Worthington Loma Linda Big Franks, Vegetable and Grain Protein Links, 6-Pound Can",2706,2019-07-20,11843
83330,162.5452668173724,Musical Instruments,"Lumiens L2 - Music Stand Light Clip On Book Reading Lamp - 4LED, 4 Levels of Brightness - No Flicker, Fully Adjustable, - Also for Mixing Table, DJ, Orchestra Pits, Craft Work, Cool Light (White)",1163,2019-07-20,38471
83331,512.0306860589569,Digital_Video_Games,TopWare RPG Collection [Online Game Code],3564,2019-07-20,491
83332,658.5318317718248,Office Products,F-301 Retractable Ballpoint 0.7mm Black 9pk (11169) pack of 2,2485,2019-07-20,23672
83333,680.150025382943,Digital_Music_Purchase,Nashville Country,1689,2019-07-20,20177
83334,626.8408690084809,Baby,P'kolino Silly Soft Seating,3576,2019-07-20,26550
83335,494.6578383623089,Grocery,Richardson Pastel Mints 4lbs Bag,2360,2019-07-20,45318
83336,794.6393799297708,Automotive,TYC 4720322 Honda Civic Driver Side Power Non-Heated Replacement Mirror.235,2935,2019-07-20,9959
83337,93.08233876826898,Baby,Bestever Baby Mat,3253,2019-07-20,45724
83338,122.98026667455463,Beauty,Disposable Trio Sponges-50 Pak Snazaroo Face Painting Sponge,1886,2019-07-20,37978
83339,331.7106317111095,Digital_Video_Download,Gangs Of New York,1880,2019-07-20,46064
83340,228.12357557777258,Digital_Music_Purchase,Sweet Summer Blue,1962,2019-07-20,11656
83341,729.7637483485875,Major Appliances,Dux Industries Poultry Scalding Vat Pre-Defeather Machine Dual Element 115V,2794,2019-07-20,46156
83342,785.3990609430974,Camera,"Canon CB-2LY OEM Battery Charger for NB-6L Li-Ion Batteries. PowerShot D10, S...",3584,2019-07-20,44360
83343,956.0276797792268,Office Products,EcoBox Brand 18 x 18 x 16 Inches Genuine Medium Moving Boxes (Pack of 10),1571,2019-07-20,26761
83344,306.8838845091369,Digital_Ebook_Purchase,Amelia's Destiny: Finding my way (Amelia Series Book 2),3395,2019-07-20,34404
83345,428.4891815678511,Automotive,Yuasa YUAM620BH YTX20HL-BS Battery,3359,2019-07-20,10333
83346,370.5822797398526,Beauty,Detangling Hair Brush: Multi-height Bristles and Staggered Rows Unravel Tangled Hair,3413,2019-07-20,20927
83347,364.90104265931353,Digital_Video_Games,Red Dead Redemption Undead,2334,2019-07-20,1903
83348,461.2887430542038,Digital_Video_Games,Tomb Raider,1394,2019-07-20,40155
83349,566.7754200464334,Digital_Music_Purchase,Volume II,1588,2019-07-20,36181
83350,285.1682831230905,Automotive,"1 Ton Electric Scissor Jack 2,200 LB Auto Car Lift 12V",2308,2019-07-20,4459
83351,71.60368266237677,Health & Personal Care,"Trinity Vibes 8.5-Inch Petite Rabbit Vibrator, Red",1254,2019-07-20,30631
83352,815.8809844802315,Office Products,HP 110 Tri-color Original Ink Cartridge (CB304AN),1744,2019-07-20,48373
83353,641.7990044271011,Books,Hope Was Here (Newbery Honor Book),2034,2019-07-20,25675
83354,64.90042170311892,Digital_Video_Games,Euro Truck Simulator 2 [Download],3459,2019-07-20,25281
83355,604.5090576802749,Apparel,SSLR Men's Ombre Casual Short Sleeve Denim Shirt,1449,2019-07-20,20349
83356,341.505759309225,Automotive,3M 32044 Imperial Wetordry  Sheet3,2248,2019-07-20,45550
83357,585.1451392684047,Beauty,Sodynee Nail Polish Wall Rack Holds 96 Bottles,3076,2019-07-20,17820
83358,609.8044478440779,Beauty,Dermalogica Multivitamin Power Recovery Masque,1087,2019-07-20,8455
83359,107.90779138272471,Music,Missa Pange Lingua/Missa La Sol Fa Re Mi,3383,2019-07-20,37146
83360,966.6557885093364,Digital_Ebook_Purchase,The Runaway Pastor's Wife,2017,2019-07-20,16044
83361,577.9378813296398,Electronics,Denon NFC対応 ポータブル BluetoothスピーカーEnvaya Mini 高音質aptX対応,2126,2019-07-20,24328
83362,31.107922479695738,Musical Instruments,Crafty Gizmos Black Adjustable Folding Music Stand with Carrying Bag,2955,2019-07-20,25268
83363,141.14819529780013,Digital_Video_Download,Fading Gigolo,1261,2019-07-20,3082
83364,186.33426420127574,Mobile_Apps,Meme Generator Free,2973,2019-07-20,25401
83365,535.5256568068006,Books,Boot Camp: Be All You Used to Be The Sergeant's Fitness and Nutrition Program,1601,2019-07-20,49513
83366,896.6374174086878,Apparel,Anne Klein Women's Double-Breasted Wool-Blend Coat,2524,2019-07-20,25120
83367,50.642478751549405,Office Products,Slinger Digital Storage Aluminum Case for Eight SD/MMC Secure Digital Cards,1734,2019-07-20,45463
83368,486.75223738176857,Mobile_Electronics,Gadget Zone(US Seller) Flexible USB 10 LED Light Lamp For Keyboard Reading Notebook Laptop PC Black,3505,2019-07-20,6070
83369,998.0296441544734,Electronics,JBL Charge 2 Portable Bluetooth Speaker,1168,2019-07-20,2616
83370,588.3353919063912,Automotive,"Pontiac Grand Prix Headlight Assembly, Driverside",1004,2019-07-20,20160
83371,648.7850381198326,Digital_Ebook_Purchase,White Tombs (A John Santana Novel Book 1),1220,2019-07-20,15608
83372,228.47386325468503,Health & Personal Care,"Sunbeam King-Size Microplush/SoftTouch Heating Pad,  4 Temperature Settings with Digital LED Controller, 2-Hour Auto Shut-Off, Machine Washable, 12'' x 24''",3317,2019-07-20,15815
83373,437.6829208293262,Camera,Canon EF 75-300mm f/4-5.6 III Telephoto Zoom Lens for Canon SLR Cameras,1937,2019-07-20,7481
83374,391.2986546012184,Baby,Pampers Swaddlers Preemie Mini Pack 20 Count,2362,2019-07-20,44395
83375,581.2719956275185,Beauty,Pierre Cardin Eau de Cologne Spray 8 oz,1521,2019-07-20,43339
83376,561.0838691238879,Digital_Video_Download,Elsa & Fred,2041,2019-07-20,49372
83377,980.357982832807,Automotive,I Love Heart ALLIGATORS - Window Bumper Sticker,1871,2019-07-20,22153
83378,657.5738871641586,Major Appliances,LG WM3477HS,1220,2019-07-20,18159
83379,22.121776749085573,Beauty,"Mango Butter White Raw, 1 Lb",2492,2019-07-20,44770
83380,800.017072435472,Apparel,Nautica Sleepwear Women's Plush Hooded Lounger Robe,2023,2019-07-20,27770
83381,618.1851252833522,Major Appliances,"Frigidaire FFHT2117L 20.5 Cubic Foot Top Freezer Refrigerator with Store-More Organization System and,",3532,2019-07-20,15878
83382,243.76697001755338,Digital_Video_Games,Civilization Complete Pack [Download],3062,2019-07-20,12721
83383,755.9686877818403,Digital_Video_Games,LA Noire,1981,2019-07-20,11869
83384,363.15865503041863,Baby,Starting Small Novelty Hamper,1245,2019-07-20,29503
83385,100.07945538463494,Health & Personal Care,"Wowlife Glass Dildo for Women, Crystal Masturbator",3491,2019-07-20,49060
83386,956.9014428720595,Electronics,"32gb Slim TONIK Mp3 Mp4 Player with 1.8"" LCD Screen Fm Radio, Video Games & Movie Silver",1462,2019-07-20,47756
83387,627.1463892862633,Grocery,Homemade My Way Summer Savory 2 Oz to 8 Oz Size Options,2714,2019-07-20,232
83388,121.29405464198237,Baby,Summer Infant Dr. Mom Nasal Aspirator (Discontinued by Manufacturer),3078,2019-07-20,40539
83389,73.24016451133795,Beauty,Seki Edge Stainless Steel Fingernail Clipper Hand And Nail Care Products,3134,2019-07-20,48244
83390,176.79662469270565,Grocery,"Boulder Canyon Sweet Vidalia Kettle Cooked Potato Chips, 6 Ounce (Pack of 12)",1389,2019-07-20,6865
83391,620.3121933274273,Digital_Music_Purchase,I'm Sticking With You (Album Version),1625,2019-07-20,30840
83392,306.47850541762307,Furniture,Antique Finish Bookshelf/ Magazine Table,1846,2019-07-20,39750
83393,230.3320332290573,Furniture,Donco Kids Twin Loft Tent Bed with Slide - Light Espresso,1007,2019-07-20,7453
83394,996.9553411501124,Mobile_Apps,show box,1591,2019-07-20,36174
83395,399.00757570121704,Health & Personal Care,"Passion Silicone Sexy Adult Toy ,Female Vibrators G-Spot Sex Toys, Vagina and Clitoris Stimulator Womens Naughty Toys",1142,2019-07-20,38232
83396,79.36298972864316,Digital_Ebook_Purchase,Finding Pride (Pride Series Romance Novels Book 1),3148,2019-07-20,48895
83397,594.1579953199515,Musical Instruments,Eventide H9 Core Multi-Effects,2055,2019-07-20,20727
83398,807.7579843443502,Beauty,"Earthly Body 3-in-1 Suntouched Body Massage Candle Skinny Dip, 6.8oz",1591,2019-07-20,6783
83399,36.56735564781656,Office Products,"HP Everyday Photo Paper, Matte (100 Sheets, 8.5 x 11 Inches)",3058,2019-07-20,44516
83400,842.0049760988372,Digital_Video_Download,Barefoot,2647,2019-07-20,31253
83401,360.0567275785431,Health & Personal Care,Drive Medical Blue Streak Wheelchair with Flip Back Desk Arms and Elevating Leg Rests,2654,2019-07-20,15926
83402,27.595140986600484,Apparel,Sexy Women Hollow Crochet Sleeveless Swimsuit Bikini Swim Cover Up Dress White,3547,2019-07-20,16866
83403,768.4133841081166,Grocery,"Trident Sugar Free, 14 ct (Pack of 12)",1533,2019-07-20,48883
83404,962.3466987667564,Books,The Buzz on Exercise and Fitness,1979,2019-07-20,6141
83405,507.5564483962658,Apparel,Lilly Pulitzer Women's Jupiter Island Tunic,1856,2019-07-20,18623
83406,27.878360404354527,PC,Keyboard mouse combo,2435,2019-07-20,24211
83407,748.8637471627981,Digital_Ebook_Purchase,"Left With The Dead (A ""Gathering Dead"" Novella)",2297,2019-07-20,679
83408,39.44403243088352,Musical Instruments,Aquila AQ-4 Soprano Regular Set High G Ukulele String Packs,2062,2019-07-20,16658
83409,759.2438942922703,Musical Instruments,Meinl Cymbals HCS Traditional Hi Hat Pair (VIDEO),3225,2019-07-20,18025
83410,70.23255932857825,Musical Instruments,Adam Hall PAD ECO Series SPADECO1 Monitor Isolation Pad,2881,2019-07-20,31160
83411,537.1754030535187,Furniture,"Mahogany Sunflower Jacquard Fused Reversible Runner, 13 by 72-Inch, Yellow",2417,2019-07-20,27718
83412,803.3998347251121,Outdoors,Kahtoola MICROspikes Traction System,2085,2019-07-20,35951
83413,37.054770644039266,Baby,Summer Infant SwaddlePod,2585,2019-07-20,44559
83414,346.29612273468564,Digital_Video_Download,"Allegiance, Season 1",2240,2019-07-20,3189
83415,340.19450785256237,Outdoors,Park Repair Stand Replacement Parts: PCS,1665,2019-07-20,34315
83416,335.95400304801353,Mobile_Apps,Blocky Roads Pro,2716,2019-07-20,42937
83417,474.7848975983274,Apparel,DressForLess Men's Layered Hooded Leather Jacket,1780,2019-07-20,4489
83418,135.4546182312764,Apparel,Scarf Rings Bails 18pcs Wholesale Multiple Style Silver Plated Scarf Accessory,1931,2019-07-20,38040
83419,89.34018390855121,Musical Instruments,CHAUVET DJ CH06 Lightweight Lighting Stand w/T-Bar,1480,2019-07-20,6961
83420,451.997217618641,Grocery,"Bragg Organic Unfiltered Apple Cider Vinegar, Raw, 16 Ounce - 1 Pack",1772,2019-07-20,43092
83421,507.67066102193553,Musical Instruments,Sourcingbay Portable Electronic Roll up Drum Pad Kit Silicon Foldable with Stick,1138,2019-07-20,16670
83422,149.9157055576035,Health & Personal Care,My Cleaning Secret Cleaning Solution by Chef Tony 14 oz,2322,2019-07-20,13945
83423,123.04273503164434,Apparel,Wildmant Men's Balls Lifters Protruder - Black/M,3262,2019-07-20,26385
83424,562.9281471088586,Gift Card,Amazon.com eGift Cards,3278,2019-07-20,20099
83425,325.0438466772934,Digital_Software,Vegas,2040,2019-07-20,17792
83426,998.6657677399024,Books,The Key,1764,2019-07-20,37689
83427,382.5505430430983,Books,How to Save Money Every Day,1162,2019-07-20,25226
83428,133.5408852704058,Major Appliances,Boboshop® Heart-shape Silicone Ice Chocolate Cake Jelly Candy Mould Mini Tray Pan Cube 15-pcs Per Mold,2732,2019-07-20,2160
83429,135.79898285840477,Beauty,"Udderly Smooth Body Cream Skin Moisturizer, 10-Ounce Jars with Dispenser Pump (Pack of 4)",1944,2019-07-20,19479
83430,893.0713453713686,Books,Guinea Pigs (Pets  Series),2490,2019-07-20,41163
83431,873.0057681787921,Digital_Ebook_Purchase,"Fifty Shades Darker (Fifty Shades, Book 2)",3368,2019-07-20,42566
83432,746.8923025901022,Electronics,"Officially Licensed Hello Kitty KT2052 Alarm Clock Radio with Bed Post NIGHT LIGHTS! Wake to Radio or Alarm ~ Large, Easy to Locate Snooze Button ~ Two Bedposts Light Up for Night Light (On/Off Switch) ~ Built in cord ~ Battery Backup ~ This pink alarm clock radio is a great gift for girls of any age",1479,2019-07-20,17017
83433,460.1925222650794,Outdoors,(1) IonPod Stainless Steel Water Ionizer by Healthy Habits (ONE PACK),3392,2019-07-20,31330
83434,999.2103779722303,Grocery,Nongshim Shin Noodle Black Cup,3204,2019-07-20,12326
83435,891.367138576781,Camera,CaseCrown Compact Travel Case (Crimson) for the Nikon Coolpix L22 12.1MP Digital Camera,1289,2019-07-20,11029
83436,311.1709032626288,Mobile_Electronics,Battery Gauge 12v Meter Indicator Boat Marine Jet Ski Sail Generator Searay Fish,1624,2019-07-20,15286
83437,29.20866962548604,Furniture,"Best Selling Chocolate Brown T-Stitch Leather Dining Chair, 2-Pack",1891,2019-07-20,8652
83438,248.44882961841645,Digital_Video_Games,Gunship! [Online Game Code],1530,2019-07-20,20851
83439,932.7439353178872,Furniture,Mirage Mirrored 2-Drawer Console Table,3015,2019-07-20,31236
83440,303.9205895014428,Outdoors,Greenfield KS2 Alloy Black Bicycle Kickstand,1291,2019-07-20,37631
83441,396.6161311790506,Digital_Video_Download,Beyond the Lights,1044,2019-07-20,37758
83442,818.7684267264397,Apparel,2-14 Blush Pink or Ivory Beaded Waist Tulle Party Flower Girl Tea Length Dress,2479,2019-07-20,37296
83443,583.5996356526875,Grocery,"Cento San Marzano Organic Peeled Tomatoes, 28 Ounce",2784,2019-07-20,42738
83444,161.70946271718,Major Appliances,AE-SELECT Whirpool / Kenmore Ice Maker Icemaker OEM Original Part# 4317943,2252,2019-07-20,13370
83445,543.1580080551904,Mobile_Apps,Crunchyroll - Watch Anime & Drama Now!,3172,2019-07-20,11153
83446,142.87389989397178,Digital_Ebook_Purchase,"The Storybook Hero (Lessons in Love, Book 3)",1140,2019-07-20,645
83447,849.0833753740255,Health & Personal Care,"Pure Thermogenic Fat Burner Supplement - Pre-workout Fat Burners - Energy, Focus, Increased Metabolism & Weight Loss - Clinical Strength with Highest Quality Formula - Premium L-tyrosine - Guaranteed By Nature Bound",1677,2019-07-20,25937
83448,384.1474582767489,Music,Fragments of a Rainy Season,1307,2019-07-20,35136
83449,329.2211327321584,Digital_Video_Games,Prototype Pack [Online Game Code],1484,2019-07-20,37231
