sale_id,sales_amount,product_category,product_name,date,customer_id
313271,729.9008092750805,Electronics,ZITRADES LED RGB Light Strips Male Connector RGB Wire Cable For SMD 5050/3528 RGB LED Strip light Pack of 10 BY ZITRADES,2023-09-26,40329
313272,756.5455934875105,Grocery,Equal Spoonful - 4 oz,2023-09-26,29233
313273,725.4796992892249,Digital_Video_Download,The Town That Dreaded Sundown (2014),2023-09-26,45622
313274,843.3935311031638,Digital_Ebook_Purchase,Eat and Run: My Unlikely Journey to Ultramarathon Greatness,2023-09-26,7202
313275,820.5622674243983,Grocery,Garofalo Gluten Free Spaghetti Pasta - 16 oz,2023-09-26,45457
313276,539.3829721454006,Baby,OXO Tot Mini Dust Pan & Brush Set,2023-09-26,29500
313277,923.1588807492617,Office Products,"Smead Clear Front Report Cover, Three Double Tang Fasteners, Side Fastener, Up to 125 Sheets/1-1/8"" Capacity, Letter Size, Linen Stock Dark Blue, 5 per Pack (87443)",2023-09-26,28666
313278,163.76599779960506,Books,The Buzz on Exercise and Fitness,2023-09-26,8874
313279,452.31104994123075,Home Entertainment,Google Chromecast HDMI Streaming Media Player,2023-09-26,10639
313280,164.52860580583985,Outdoors,Schwinn Joyrider Bicycle Trailer (Red/Gray),2023-09-26,2854
313281,269.1288196722855,Baby,"Summer Infant Ultra Plush Changing Pad Cover, Pink",2023-09-26,7842
313282,218.51432822998626,Beauty,"Corner Shelf Cosmetic Organizer 16"" High",2023-09-26,26475
313283,340.1322485424248,Major Appliances,"AVANTI IHP1800L1B-IS 1800W Portable Induction Cooktop, Black",2023-09-26,20149
313284,781.1744831760996,Furniture,LOT OF 2 SET NEW TABLE MATE 2 AS SEEN ON TV PORTABLE ADJUSTABLE TV DINNER TRAY TABLEMATE II,2023-09-26,36134
313285,531.3466310987146,Beauty,BMR FACE,2023-09-26,45950
313286,225.87811590057234,Major Appliances,AE-SELECT Whirpool / Kenmore Ice Maker Icemaker OEM Original Part# 4317943,2023-09-26,44747
313287,871.2675615443284,Mobile_Apps,Call of Mini™ Infinity,2023-09-26,46516
313288,538.4745894217773,Digital_Ebook_Purchase,The Victory Season: The End of World War II and the Birth of Baseball's Golden Age,2023-09-26,32148
313289,951.8950808862896,Beauty,L'Homme Libre Cologne For Men by Yves Saint Laurent,2023-09-26,45295
313290,642.3493440681059,Mobile_Electronics,Magnetic Magnet Leather Cover Sleeve Case For NOOK GlowLight (NOOK 4th Gen) - (NOT fit NOOK Simple Touch with GlowLight NOOK 3rd Gen or NOOK Simple Touch NOOK 2nd Gen),2023-09-26,14254
313291,424.4364891251559,Mobile_Apps,The Tribez,2023-09-26,864
313292,155.62591448271758,Digital_Ebook_Purchase,HOSTILE WITNESS: A Josie Bates Thriller (The Witness Series Book 1),2023-09-26,49694
313293,57.30798524811037,Beauty,Touch Mineral Pressed CREAM (Taffeta),2023-09-26,31221
313294,569.2714062289771,Apparel,Kangaroo Black Hat,2023-09-26,47120
313295,626.9764344915592,Baby,"World of Eric Carle, The Very Hungry Caterpillar Ring Rattle",2023-09-26,20218
313296,357.9044486052458,Apparel,Womens Casual Slim Fit Ink Painting Print Plus Size Linen Dress,2023-09-26,6922
313297,477.0422627321974,Furniture,2pc Sofa Set in Deep Black Bonded Leather,2023-09-26,46455
313298,960.2786181472876,Mobile_Apps,Amazing Mahjong: Zen,2023-09-26,46717
313299,240.22365897584774,Digital_Music_Purchase,Right Place Wrong Time,2023-09-26,12558
313300,223.7678443425938,Musical Instruments,Your Cable Store XLR 3 Pin Male / Female Microphone Cable 28 AWG,2023-09-26,27552
313301,775.1133192915486,Beauty,Bath Soak with Dead Sea Mineral Salt for Muscle Pain - Natural Skin Detox & Relaxing Aromatherapy with Organic Lavender Clary Sage & Palmarosa - Relieve Stress & Strengthen Immune System Scoop Inside,2023-09-26,40068
313302,654.2046505107011,Outdoors,Power Grips Toe Straps,2023-09-26,35561
313303,101.56082891845567,Grocery,"Marich Chocolate Cherries, 2.3-Ounce (Pack of 12)",2023-09-26,22650
313304,799.1359868067485,Digital_Video_Download,We Were Soldiers,2023-09-26,7515
313305,483.8038012801967,Health & Personal Care,"Babyganics Face, Hand & Baby Wipes, Fragrance Free",2023-09-26,6292
313306,513.083446105551,Digital_Video_Download,Downton Abbey Season 1,2023-09-26,44473
313307,335.5708696667206,Camera,NEEWER Vertical Battery Grip with LCD Screen Monitor Replacement BG-E8 - Capacity to Hold 2PCS LP-E8 Batteries or 6PCS AA Batteries for Canon EOS 550D/T2i 600D/T3i 650D/T4i 700D/T5i,2023-09-26,32294
313308,705.458099196658,Grocery,Tea Forté Large Tin Sampler Collection - World of Teas,2023-09-26,13455
313309,457.244879464682,Digital_Video_Download,Sons Of Anarchy Season 4,2023-09-26,3655
313310,357.9906712730653,Baby,Stokke Tripp Trapp Baby Set,2023-09-26,22556
313311,274.558827405351,Digital_Video_Download,All That Volume 1,2023-09-26,14967
313312,946.9136443387763,PC,Case Logic LAPS-116 15 - 16-Inch Laptop Sleeve (Pink),2023-09-26,19746
313313,704.5023004309485,Automotive,"WIX Filters - 24815 Cabin Air Panel, Pack of 1",2023-09-26,47203
313314,398.3765326977771,Major Appliances,Beer Dispenser Kegerator Refrigerator - EdgeStar,2023-09-26,19550
313315,881.3952154851247,Major Appliances,Kenmore Dishwasher Silverware Basket 8562080 White,2023-09-26,36156
313316,369.41964784565886,Major Appliances,LG : 3911EZ9131X LG Electronics/Zenith Side Venting Kit - Stainless Steel,2023-09-26,17705
313317,300.3897874325226,Health & Personal Care,Bulletproof Brain Octane Oil,2023-09-26,42364
313318,999.8052753731113,Camera,Sony Cyber-shot DSC-TX5 10.2MP CMOS Digital Camera with 4x Wide Angle Zoom with SteadyShot Image Stabilization and 3.0 Inch Touch Screen LCD (Black) (OLD MODEL),2023-09-26,15359
313319,497.1230328071199,Digital_Video_Games,The Mystery of the Crystal Portal [Download],2023-09-26,46350
313320,116.27335048157731,Digital_Ebook_Purchase,The MacKinnon Curse (The Beginning novella) (MacKinnon Curse novel Book 4),2023-09-26,28890
313321,876.6705277105283,Outdoors,Red Ledge Youth Rainstop Parka,2023-09-26,16545
313322,904.6683528978311,PC,Sony Class 10 Micro 95MB/s Memory Card,2023-09-26,9723
313323,926.0898380792039,Apparel,Classic Paisley Design Pre Tied Fitted Bandana Womens Head Wrap Scarf,2023-09-26,28314
313324,807.5489294586782,Digital_Software,BitDefender Total Security 2011 - 3 PC-2 years [OLD VERSION],2023-09-26,42091
313325,634.7647138302372,Outdoors,COLEMAN Camping Tailgating Portable Propane RoadTrip Party Grill w/ Instastart,2023-09-26,17146
313326,389.68043613655203,Camera,Toshiba Camileo X100 Full-HD Camcorder - Silver/Black (Discontinued by Manufacturer),2023-09-26,15382
313327,171.7894532331574,Automotive,Yuasa YUAM620BH YTX20HL-BS Battery,2023-09-26,32036
313328,343.2611425431046,Automotive,3M 0 Finesse-It II Machine Polish - 1 Quart,2023-09-26,49509
313329,13.272560646494622,Furniture,Serta Upholstery Fabric San Chocolate / Raisin Chaise,2023-09-26,18992
313330,968.932857633922,Digital_Music_Purchase,20 Years,2023-09-26,19771
313331,492.5523538009313,Digital_Video_Games,Towerfall Ascension  - PS4 [Digital Code],2023-09-26,28273
313332,58.09085702761994,Mobile_Apps,100 Brands - Pic Guess Game,2023-09-26,12611
313333,868.1021723368488,PC,"Surface 3 Case, Snugg8482; - Leather Sleeve Case with for Microsoft Surface 3",2023-09-26,913
313334,143.53524613724252,Mobile_Apps,Diner Dash,2023-09-26,44081
313335,248.90276231335537,Digital_Music_Purchase,Get Crunk-Finao Feat. Ticky Diamondz,2023-09-26,28328
313336,104.3901896715193,Outdoors,Pedco UltraPod Lightweight Camera Tripod,2023-09-26,35028
313337,202.15011955113218,Digital_Ebook_Purchase,RitualCraft: Creating Rites for Transformation and Celebration,2023-09-26,443
313338,168.22588737706585,Mobile_Electronics,Protective Travel Carrying Case For Big Jawbone® Jambox® Wireless Bluetooth Speaker - Black,2023-09-26,37576
313339,928.0520288579094,Digital_Video_Download,The Lord of the Rings: The Return of the King,2023-09-26,24227
313340,492.36786194794104,Books,"Expecting Adam: A True Story of Birth, Rebirth, and Everyday Magic",2023-09-26,1265
313341,340.4207151276712,Grocery,"Viva Naturals Organic Extra Virgin Coconut Oil, 54 Ounce",2023-09-26,8476
313342,302.8638634502548,Digital_Video_Games,The Great Wall of Words [Download],2023-09-26,25181
313343,445.9711221654397,Apparel,ENDO Apparel California Flag Right to Keep and Bear Arms Infringed Men's T-Shirt,2023-09-26,40621
313344,483.9765143435671,Gift Card,Amazon eGift Card - Celebrate,2023-09-26,29725
313345,875.4473036354518,Beauty,Ginkgo Store Fashion Women Korea Simple Style PU leather Clutch Handbag Bag Totes Purse Orange,2023-09-26,29099
313346,159.56219713649264,Mobile_Electronics,881 Super White Car Light Bulbs 27W (2-Pack/DC 12V),2023-09-26,42630
313347,90.43763919731552,Mobile_Apps,Alarm Clock for Me free,2023-09-26,40126
313348,272.98160142470385,Major Appliances,"Haier HT21TS77SP Energy Star Rated Frost-Free Top Freezer Refrigerator, 20.7 Cubic Feet, White",2023-09-26,24107
313349,146.54077362575475,Mobile_Electronics,Generic E6 Auto Car Voice Radar Detector Alert LED Display for Vehicle Gps Navigator,2023-09-26,42600
313350,635.9822698166429,Digital_Software,H&R Block At Home Premium + State,2023-09-26,1771
313351,925.8920438893803,Grocery,"Tattle Tea CO2 Decaf Earl Grey Black Tea Blend, 2 Pound",2023-09-26,17994
313352,262.549065013837,Health & Personal Care,Coastal Colors Everything Hurts and I'm Dying Sarcastic Snarky Humor Metal Tampon Case: Holds Up to 8 Tampons Crush-Proof in Your Purse,2023-09-26,4172
313353,245.34396240244268,Major Appliances,Coolit Systems USB Beverage Chiller,2023-09-26,27522
313354,137.7305805970642,Digital_Ebook_Purchase,Crazy For You (A Controversial Romance),2023-09-26,6300
313355,468.3229371951586,Automotive,Xantrex XPower Powerpack 400 Plus Portable Backup Power Source,2023-09-26,48322
313356,551.9875417376795,Mobile_Electronics,eForCity Reusable Anti-Glare Matt Screen Protector LCD Film Guard Compatible with Barnes & Noble Nook Simple Touch with GlowLight,2023-09-26,36559
313357,229.03253795288433,Digital_Video_Games,World War 2: Panzer Claws and Panzer Claws 2 [Download],2023-09-26,23812
313358,141.80966845605957,Health & Personal Care,"Biotin (High Potency) 5000mcg Per Veggie Softgel; Enhanced with Coconut Oil for better absorption; Supports Hair Growth, Glowing Skin and Strong Nails; 120 Mini-Veggie Softgels; Made In USA.",2023-09-26,28856
313359,923.7363089400242,Digital_Software,H&R Block At Home 2011 Basic,2023-09-26,9901
313360,527.2912529810367,Digital_Ebook_Purchase,Lost and Found (Lost & Found Book 1),2023-09-26,34353
313361,389.1912081387848,Digital_Ebook_Purchase,Bundle of Joy: Rocky Hill Romance (A Rocky Hill Romance Book 2),2023-09-26,34597
313362,545.9670659208269,Office Products,"SPEED Compatible Ink Cartridge Replacement for Epson T126 (4xBlack, 2xCyan, 2xMagenta, 2xYellow, 10-Pack)",2023-09-26,24963
313363,121.06973291224722,PC,ZAGG invisibleSHIELD for Apple iPad Mini (TFAPPIPADMINLE),2023-09-26,4114
313364,86.39154671284571,Mobile_Apps,US States Capitals & Flag Quiz,2023-09-26,7073
313365,361.26997108086954,Musical Instruments,"X8 Drums SHAK-NAT Wooden Egg Shaker Set, Natural",2023-09-26,34936
313366,809.0184355630889,Beauty,CND Shellac Creative Nail Shellac UV Color Coat Rubble Color 0.25 oz,2023-09-26,39207
313367,936.7375042611145,Digital_Video_Download,Book of Life,2023-09-26,27368
313368,952.1296079157239,Apparel,"Newsboy Cable Knitted Hat for Women in Black, Charcoal, Light Grey, Off White",2023-09-26,39483
313369,831.3053180546315,Digital_Video_Download,The Chicago Code Season 1,2023-09-26,21528
313370,289.84964062461125,Digital_Music_Purchase,Uncountry - Single,2023-09-26,34949
313371,95.8091298455289,PC,Sades PC Wired 3.5mm Stereo Over Ear Gaming Headset Headphones with Microphone,2023-09-26,21775
313372,509.9908442931793,Electronics,SONY MD80 Minidisc Neige 80 Minute Pack 10,2023-09-26,26064
313373,892.4903351823056,Health & Personal Care,"Nerve Support Formula for the Nutritional Support of Peripheral Neuropathy and Nerve Pain Relief, 120 Capsules",2023-09-26,36796
313374,308.94560272301186,Digital_Software,WhiteSmoke Writer Pro - One Year License [Download],2023-09-26,6366
313375,462.6924804969814,Grocery,Ferrara Pan Mexican Fiesta Hats - 10lb,2023-09-26,40237
313376,107.55232591914927,Apparel,Groovin' Purple Low Waist Hip Brief,2023-09-26,11455
313377,183.64306756794602,Automotive,Pro Grip Gas Cap Protector - Clear Honda 5030-TR-HO,2023-09-26,31429
313378,431.63025471583717,Mobile_Electronics,HHI Rubber Quick Clip Case for iPod Nano 7th Generation - Black (Package include a HandHelditems Sketch Stylus Pen),2023-09-26,20029
313379,342.1757551666879,Apparel,Columbia Women's Kenzie Cove Bermuda Short,2023-09-26,1857
313380,688.8759537598042,Mobile_Electronics,LYL® 4.3'' and 5'' GPS sun shade Clip-on Glare Shield Visor,2023-09-26,25535
313381,497.90238059425036,Digital_Music_Purchase,The Gift,2023-09-26,41980
313382,259.28290279425926,Music,Music! Music! Music!: The Best of Teresa Brewer,2023-09-26,42624
313383,273.1160603427364,Automotive,MagnaFlow 93200 Direct Fit Catalytic Converter (Non CARB compliant),2023-09-26,12765
313384,573.7646284135424,Grocery,Wilderness Family Naturals Coconut Milk Powder,2023-09-26,12704
313385,241.53429711915527,Grocery,Reese's Peanut Butter Sauce 4.5 Lbs.,2023-09-26,47388
313386,639.4884534514231,Furniture,Rafferty - Traditional Dark Brown Sofa Table,2023-09-26,9722
313387,452.218954458541,Office Products,"Wilson Jones Sheet Lifters, Boomerang Easy Flow II, 45 Gauge, Black, 20/Box (W364-89)",2023-09-26,20411
313388,528.3720653065433,Music,Good Dog Bad Dog,2023-09-26,18790
313389,328.7053397932802,Outdoors,Profile Design Carbon Stryke Aerobars,2023-09-26,4379
313390,938.4154719315419,Digital_Music_Purchase,Broadway Rhythm,2023-09-26,4179
313391,173.92152142457164,Digital_Ebook_Purchase,Bang: The Most Infamous Pickup Book In The World,2023-09-26,33669
313392,99.90548711396914,Outdoors,Vector Thunderbird Pipe Lighter Insert for Flip-Top Lighters,2023-09-26,24940
313393,127.81290824597541,Musical Instruments,AUGUSTINE CLASSIC-RED MEDIUM TENSION CLASSICAL GUITAR STRINGS,2023-09-26,34263
313394,452.98469749286716,Digital_Software,Audials Moviebox 10 [Download],2023-09-26,38017
313395,428.73008349306633,Office Products,Niceroker Portable Ring style USB2.0 4/8/16/32/64GB Flash Memory Drive Stick Pen Thumb U-Disk,2023-09-26,14086
313396,598.3221217979496,Grocery,Oregon Hill Marionberry Syrup 12 oz.,2023-09-26,13964
313397,474.1129966972276,Musical Instruments,iMBAPrice iMBA-PS-12MM Gold Plated 3.5mm Stereo Audio Cable,2023-09-26,5941
313398,78.71921939429856,Beauty,Real Lavender Essential Oil :: Pure Undiluted,2023-09-26,40339
313399,221.25346839628733,Grocery,ProFlowers - 19 Count Pink Deluxe Fragrant Stargazer Lilies w/Free Clear Vase - Flowers,2023-09-26,38778
313400,451.92051201247625,Music,Evening of Yes Music Plus,2023-09-26,1509
313401,869.6515461353467,Digital_Video_Games,Blood Bowl Legendary Edition [Download],2023-09-26,43302
313402,530.0315042367231,Digital_Music_Purchase,Rustic Poet,2023-09-26,46075
313403,447.35433923294005,PC,"Aluminum 3.5"" Dual Bay SATA to USB 2.0 (SATA I and II) JBOD/BIG Enclosure (DOES NOT INCLUDE HARD DRIVE)",2023-09-26,417
313404,729.9308700692619,Beauty,WEN® by Chaz Dean Treatment Oil 2oz (Lavender Mint),2023-09-26,10161
313405,579.566547418301,Grocery,"Williams, Ssnng Chili Original 1 oz  (Pack of 12)",2023-09-26,27920
313406,267.96955473617595,Digital_Ebook_Purchase,The Fifteen (Jacquot Book 3),2023-09-26,38152
313407,40.43059195738316,Health & Personal Care,BulkSupplements Pure Magnesium Glycinate Powder,2023-09-26,9258
313408,747.0330122007776,Health & Personal Care,"ORGANIC INDIA Natural Turmeric Root Veg Capsules, USDA Certified Organic, High Bioavailability Formula",2023-09-26,8927
313409,382.2276402660494,Mobile_Electronics,Stanley Meyers Electronic switch pre-assembled S10.010,2023-09-26,13693
313410,549.2832486200015,Grocery,"Monin Flavored Syrup, White Sangria Mix, 750 ml bottle",2023-09-26,48127
313411,913.1753325108539,Music,Center Stage (2000 Film),2023-09-26,43766
313412,367.1950112022101,Apparel,Natori Women's Aphrodite Maxi Dress,2023-09-26,12469
313413,685.7520319139859,PC,"Kuzy - Ombre Colors Keyboard Cover for Older MacBook Pro 13"" 15"" 17"" (with or w/out Retina Display) iMac and MacBook Air 13"" Silicone Skin - Ombre",2023-09-26,6859
313414,516.1904474564813,Books,Master and Commander,2023-09-26,44949
313415,980.0693413455244,Digital_Video_Games,Robin Hood: The Legend of Sherwood [Download],2023-09-26,48648
313416,570.7581835477639,Major Appliances,Kenmore Refrigerator Bisque Touch-Up Jar,2023-09-26,46053
313417,377.66335521352073,Mobile_Apps,Strawberry Shortcake Berry Beauty Salon,2023-09-26,30432
313418,236.0396633683493,Digital_Music_Purchase,Drum & Bass Arena Summer Selection 2011,2023-09-26,17287
313419,708.8905138022777,Digital_Video_Games,Slingo Quest Egypt [Download],2023-09-26,22198
313420,272.50580188305526,Apparel,Billabong Men's Your Bong Short Sleeve T-Shirt,2023-09-26,12769
313421,570.1312097265305,Baby,"BOB Revolution CE Stroller, Black",2023-09-26,47625
313422,540.061642111393,Books,By Any Other Name,2023-09-26,13707
313423,793.4617236003503,PC,AC Adapter/Power Supply&Cord for Lenovo ThinkPad 2767H9U 35082GU L412 L420 L512 L520 T410si T420 T420i T510i T520i TYPE 2847 X100 X200t X201i X201s X201t X220t,2023-09-26,3814
313424,753.1952560130627,Musical Instruments,"LEDwholesalers 12-Volt 16.4-ft RGB Color-Changing Kit with Controller and IR Remote, Power Supply, and LED Strip in White PCB, 2034RGB-R2+3369+3208",2023-09-26,29743
313425,181.26430925458567,Outdoors,"Hobson Pro Hub X2 Saddle, Black",2023-09-26,9459
313426,552.1563988033633,Books,"Tuck Everlasting, 25th Anniversary Edition (Sunburst Books)",2023-09-26,2921
313427,578.2853053225089,Apparel,MJC International Men's Generic Faux Denim Pajama Pant,2023-09-26,34210
313428,410.50637594530974,Camera,Canon G12 10 MP Digital Camera with 5x Optical Image Stabilized Zoom and 2.8 Inch Vari-Angle LCD OLD MODEL,2023-09-26,40453
313429,178.15563934984408,Digital_Ebook_Purchase,Penguins: Amazing Pictures & Fun Facts on Animals in Nature (Our Amazing World Series Book 9),2023-09-26,8686
313430,543.2954787130259,Mobile_Electronics,Amjimshop Vovotrade(TM)hot sale!! Multi-function Car Kit Mp3 Player Wireless Fm Transmitter Modulator Audio Aux USB Sd MMC Slot with Remote Red LCD,2023-09-26,18840
313431,367.2304031874216,Apparel,Roman Fashion Women's Kimono Sleeve Metallic Polka Dot Shirt,2023-09-26,28989
313432,52.36635206389056,Outdoors,Kelty Riff Backpack,2023-09-26,17357
313433,149.11280368230598,Digital_Video_Download,The Jinx,2023-09-26,38788
313434,414.4177527692088,Beauty,"Design Essentials 2-N-1 Dry Finishing Lotion to Restore, Define & Revitalize Waves, Curls, and Texturized Styles -Wave By Design Collection, 8oz.",2023-09-26,6839
313435,938.3232135728412,Books,Night Angel 1: A Novel (Night Angel 9),2023-09-26,44186
313436,287.8740262016196,Digital_Ebook_Purchase,My Misery Muse,2023-09-26,44923
313437,915.2390021442403,Furniture,Poundex Bobkona St. Croix Vanity Set with Stool White Color,2023-09-26,19925
313438,114.44700910791673,Camera,Sony NP-FV Series Rechargeable Battery Pack (Retail Packaging),2023-09-26,29991
313439,493.5088094906218,Digital_Ebook_Purchase,Cry Baby,2023-09-26,45880
313440,453.0343760097449,Office Products,Sophia Global Remanufactured Ink Cartridge Replacements for HP 60XL RESET Line,2023-09-26,38665
313441,173.67912809013174,Apparel,DC Comics Reversible Good Versus Evil Men's T-Shirt,2023-09-26,48172
313442,181.8741513060503,Camera,Flip Video Power Adapter,2023-09-26,1903
313443,654.9441735374644,Digital_Music_Purchase,Irie State of Mind,2023-09-26,21128
313444,510.35606102095153,Major Appliances,"Kucht 3078u Pro-Style 30"" Stainless Steel Gas Fuel Sealed Burner Range - Convection",2023-09-26,26182
313445,992.2134644664737,Music,Would We Be Alive,2023-09-26,44826
313446,879.2488831634196,Beauty,Alfaparf Semi Di Lino Diamante Illuminating Essential Oil Kit,2023-09-26,26283
313447,266.2946553529756,Digital_Music_Purchase,An Acoustic Evening (Live at the Vienna Opera House),2023-09-26,3432
313448,301.2149841875509,Mobile_Apps,World's Biggest Wordsearch - Your daily free word search puzzle!,2023-09-26,11273
313449,883.7902426984627,Major Appliances,Coldtower Kegerator Tower Cooler,2023-09-26,22348
313450,919.7815829792256,Apparel,Faux Real Men's Hairy Belly Poinsettia Ugly Christmas Sweater Printed T-Shirt,2023-09-26,48402
313451,379.1008216786753,Music,Marie Christine (1999 Broadway Cast),2023-09-26,42753
313452,539.0607767185037,Digital_Music_Purchase,Rebound,2023-09-26,21300
313453,745.6747325126171,Major Appliances,Sharp Microwave Drawer Oven,2023-09-26,30426
313454,107.26555849694961,Digital_Video_Download,"Locked Up Abroad, Season 6",2023-09-26,41495
313455,374.3776895292148,Digital_Music_Purchase,Forza Dentro Me,2023-09-26,40670
313456,174.73825825871734,Grocery,"Medaglia D'Oro Instant Espresso Coffee, 2 Ounce (Pack of 12)",2023-09-26,7948
313457,608.5953715077802,Digital_Ebook_Purchase,Immortally Yours (Monster MASH),2023-09-26,40259
313458,990.8737497671657,Musical Instruments,"Pyle PSUFM625 Disco Jam 600 Watt 2-Way PA Speaker System, SD Card Reader, FM Radio, AUX/MP3 Input, USB Charging",2023-09-26,8593
313459,292.7831517377155,Office Products,"X-ACTO Standup Mini Electric Sharpener, Mini Vertical - Silver (1724)",2023-09-26,2103
313460,32.808353012605934,Beauty,NARS The Multiple,2023-09-26,38337
313461,51.59414495360428,Furniture,Home Styles Dolly Madison Kitchen Island Cart,2023-09-26,2846
313462,694.6760235378031,Electronics,Kaito T-1 Radio antenna,2023-09-26,37788
313463,726.5543688379872,Digital_Music_Purchase,Taylor Gang (Bonus Track) [Explicit],2023-09-26,22812
313464,909.1696351872389,Automotive,WeatherTech Front Mud Flap for Select Chevrolet/GMC Models (Set of 2),2023-09-26,31435
313465,695.3382032141078,Digital_Music_Purchase,Dictaphone's Lament,2023-09-26,1345
313466,35.431406587373196,Mobile_Electronics,The Fashion Army Green 3in1 Whistle with Compass & Temperature Display,2023-09-26,39739
313467,427.29974123242613,Digital_Video_Games,Dungeon Siege II [Online Game Code],2023-09-26,18792
313468,69.04485856834448,PC,AmazonBasics Wireless Mouse,2023-09-26,31250
313469,933.7761929767457,Music,Living Under June,2023-09-26,44211
