sale_id,sales_amount,product_category,product_name,location_id,date,customer_id
258719,673.6181144159015,Digital_Music_Purchase,You And Tequila (Featuring Grace Potter),2393,2022-10-07,48181
258720,874.0422139127899,Digital_Ebook_Purchase,Bunny and Coco Get Smashed,3185,2022-10-07,3337
258721,597.2882843949898,Beauty,"Kiki Mood Magic Lipsticks Set of 4 -12 Hours Formula with Vit. E and Aloe Vera RED,GREEN,BROWN,ORANGE",2345,2022-10-07,47326
258722,699.810110732606,Beauty,Escali 100% Pure Badger Shaving Brush,3040,2022-10-07,17251
258723,588.1155292475567,Automotive,"BDS - Folding Cup Holder (Diameter 2.5"") + One Free Smart Wrap Silicone Rubber Earphone/earbud Cord Manager Cable Winder Wrap Reel",2884,2022-10-07,11404
258724,154.99347809508055,Health & Personal Care,Walking Stick Cane or Crutch Holder - Clip On Table Rest,2156,2022-10-07,18414
258725,21.195421204184562,Books,Movable Harvests: The Simplicity & Bounty of Container Gardens,2135,2022-10-07,28150
258726,974.5132350911474,Mobile_Apps,Wheel of Fortune,2490,2022-10-07,29009
258727,913.2593348444216,Health & Personal Care,Wrinkle V Face Chin Cheek Lift Up Slimming Slim Mask Ultra-thin Belt Strap Band,1686,2022-10-07,31042
258728,876.3371765653541,Digital_Music_Purchase,Ra Ma Da Sa,2893,2022-10-07,3661
258729,437.0885672813375,Apparel,Silver Jeans Women's Plus-Size Natsuki Jean,3243,2022-10-07,45813
258730,409.9842072305306,Books,A Shelter Sketchbook: Timeless Building Solutions,3433,2022-10-07,2138
258731,652.705638008643,Major Appliances,Igloo Ice Makers.,1642,2022-10-07,18928
258732,858.3284283960138,Health & Personal Care,Drive Medical Blue Streak Wheelchair with Flip Back Desk Arms and Elevating Leg Rests,2509,2022-10-07,17868
258733,340.5478847469104,Major Appliances,Grizzly H4229 Anti-Fatigue Mats - 24&#34; x 60&#34;,2959,2022-10-07,5982
258734,461.3089567067712,PC,BTExpert Laptop Battery for Dell INSPIRON 15 3000 15-3521 15-3537 15-3541 15-3542 15-5521 15-N3521 15-N5521 15R-1528R 5200mah 6 cell,1127,2022-10-07,4705
258735,852.4785566802187,Mobile_Electronics,"ValuePad Portable Mini Bluetooth Wireless Speaker with Super Bass for Cell Phones, Computers and Tablets (Black)",1137,2022-10-07,447
258736,888.9437537493385,PC,"MoKo Keyboard Case, Universal Wireless Keyboard Cover for All-New iPad 9.7 2017, iPhone 7 / 7 Plus Red, iPad Air / iPad Pro / iPad Mini / Samsung Galaxy Tab, Black",2105,2022-10-07,5717
258737,372.84032995902226,Outdoors,"CamelBak Podium Bottle (Smoke/Racing Red, 21 -Ounce)",2821,2022-10-07,35728
258738,839.2827199155785,Furniture,Rubber Collection Squares and Leaves Multi-Color Printed Slip Resistant Rubber Back Latex Contemporary Modern Floral Runners (1163),3198,2022-10-07,20359
258739,505.2712863988624,Health & Personal Care,WAHL 17 pieces Color Pro Hair Cutting Kit Clippers Trimmer 9155-2008 +Adapter to 220/240V,1048,2022-10-07,38762
258740,203.08965207515035,Electronics,"VideoSecu Mounts Articulating TV Wall Mount for most 32"" 37"" 39"" 40"" 42"" 46"" 47"" 50"" 52"" 55"" 58"" 60"" 62"" 63"" 65"" LCD LED Plasma Flat Panel TV with VESA from 200x100 to 400x400, 600x400mm MW365BBM7 BM7",1980,2022-10-07,3932
258741,923.2397215214669,PC,"Asus G750, G750, JWG750, JHG750JX, G750JX-TB71 New 17.3"" Repalcement Laptop LED LCD Screen Glossy, Full HD FHD 1920 x 1080",1471,2022-10-07,17045
258742,881.9728215876117,Baby,Fisher Price Jumperoo,2662,2022-10-07,26799
258743,357.2130959975416,Grocery,20 Cup CAZA TRAIL Sampler! 10 Unique Varieties! Kona...Donut Lover's...Tea,1199,2022-10-07,21610
258744,144.41676379264632,Digital_Video_Download,The Miracle Worker,2030,2022-10-07,6161
258745,355.7287217929457,Baby,"Chewbeads Perry Teething Necklace, 100% Safe Silicone",2738,2022-10-07,10353
258746,266.26111148713886,Camera,Sony 16-80mm f/3.5-4.5 Carl Zeiss Vario-Sonnar T DT Zoom Lens for Sony Alpha Digital SLR Camera,2324,2022-10-07,11342
258747,635.9099159135836,Outdoors,Schrade Gunstock Trapper Old Timer Folding Knife,1619,2022-10-07,28902
258748,161.16572790412107,Music,Live: Entertainment Or Death,1874,2022-10-07,27211
258749,721.5284927641281,Digital_Software,QuickBooks Pro 2011 - [Old Version],3194,2022-10-07,44929
258750,389.9058640877945,Music,Animadverte,2638,2022-10-07,14620
258751,150.19760848403914,Health & Personal Care,Merthiolate Colorless 3 Pack Sanvall - Mertiolate Sin Color - Clear,1823,2022-10-07,15491
258752,954.8990961239199,Apparel,Calvin Klein Men's Smooth Leather Reversible Belt,2647,2022-10-07,8117
258753,128.0376245806447,Electronics,"Kensington K33084 Noise Canceling Headphone, Black",2901,2022-10-07,46675
258754,877.3677903544167,Musical Instruments,Hohner Kids Musical Toys S2203 Percussion Blocks,2728,2022-10-07,48600
258755,806.0915219270901,Books,"Mephisto (Classic, 20th-Century, Penguin)",2382,2022-10-07,36124
258756,349.7147736641552,Music,Nothing to Fear,1438,2022-10-07,45716
258757,242.7418299757106,Automotive,Bendix MKD652 Semi-Metallic Brake Pad Set,1724,2022-10-07,3271
258758,685.6278382201965,Mobile_Apps,Hay House Radio,1364,2022-10-07,506
258759,399.4125398681111,Grocery,EZ-Sweetz (2-Pack 1.36oz - Liquid De-Bittered Stevia Sweetener 300 Servings/Bottle),2530,2022-10-07,26572
258760,644.1012040979075,Major Appliances,Samsung RF34H9960S4 Chef Collection 34.3 Cu. Ft. Stainless Steel French Door Refrigerator - Energy Star,1385,2022-10-07,27439
258761,816.2243930519516,Apparel,Sexy Women Hollow Crochet Sleeveless Swimsuit Bikini Swim Cover Up Dress White,1467,2022-10-07,31061
258762,595.0044306700039,Major Appliances,"GOLDEN VANTAGE 30"" Wall Mount Stainless Steel Range Hood With Remote GVW30-B02",1825,2022-10-07,24007
258763,560.6400144445984,Outdoors,Mountainsmith Buzz II Recycled Lumbar Pack,1894,2022-10-07,30811
258764,820.3783971196754,Music,Strangers in the Night,3235,2022-10-07,4706
258765,847.5900046437342,Digital_Ebook_Purchase,Looking for Alaska,3025,2022-10-07,2887
258766,218.58239783351345,Digital_Ebook_Purchase,The Fight for Identity (The Good Fight Book 3),1502,2022-10-07,45811
258767,482.5970773862917,Automotive,Twin XL Duvet Cover Set 100% Egyptian Cotton 300 Thread Count Solid Chocolate Brown,3613,2022-10-07,18083
258768,350.2329597296657,Digital_Video_Games,Mortal Kombat Komplete Edition,1770,2022-10-07,268
258769,202.57776397387659,Mobile_Apps,QBOT V3,3309,2022-10-07,11156
258770,987.3717718871835,Outdoors,Goson Classic 57mm Mirror Lens Aviator Sunglasses,1088,2022-10-07,11117
258771,599.8867940263725,Digital_Music_Purchase,Beyond Boundaries,1143,2022-10-07,35558
258772,784.4791949119838,Gift Card,Amazon eGift Card - #1 Dad,1163,2022-10-07,33196
258773,858.088456460072,Digital_Music_Purchase,Running Like the Wind (Live),3250,2022-10-07,32242
258774,133.05432707775526,Office Products,"Uncaged Ergonomics WorkEZ Keyboard Tray & Mouse Pad, Adjustable Height & Angle Ergonomic Computer Keyboard Stand w/ Negative Tilt",3551,2022-10-07,18568
258775,539.83357259295,Music,The Last Tour On Earth,1944,2022-10-07,47561
258776,682.3716229999636,Baby,Kidco Angle Mount Safeway Pet Gate,3012,2022-10-07,14748
258777,121.21135586010698,Outdoors,Shimano SM-SH56 SPD Cleat Set,2262,2022-10-07,12392
258778,285.63571277931925,Furniture,DHP Emily Chrome Legs,3291,2022-10-07,17527
258779,948.8648110872011,Health & Personal Care,O-Cedar Multi-Use Scrunge Scrubber Sponge (Pack of 6),1030,2022-10-07,46395
258780,124.29390833216854,Grocery,LeilaLove Macarons - 4 Macarons the top 4 flavors - Me and Macarons,3418,2022-10-07,47390
258781,354.1491805190212,Furniture,5715 Burgundy Beige Area Rug Oriental Carpet Large New,3412,2022-10-07,979
258782,50.98262339897049,Grocery,20 Cup CAZA TRAIL Sampler! 10 Unique Varieties! Kona...Donut Lover's...Tea,3212,2022-10-07,11517
258783,511.08636593694735,Books,Christ And The Americas,3048,2022-10-07,1090
258784,719.7910916326749,Apparel,Ladies Okay Okay T-shirt,1453,2022-10-07,28413
258785,273.247824318745,Music,My Chemical Romance - Three Cheers For Sweet Revenge,3451,2022-10-07,4535
258786,49.56998972952712,Digital_Software,Cook'n Recipe Organizer Version 10 [Download],1515,2022-10-07,16344
258787,885.6336654247121,Digital_Video_Download,Dark Souls,1080,2022-10-07,19208
258788,336.5461309128032,Digital_Music_Purchase,Get Crunk-Finao Feat. Ticky Diamondz,2146,2022-10-07,26556
258789,915.5285951659733,Music,Funkadelia,1625,2022-10-07,25016
258790,841.5998965724713,Digital_Video_Download,The Returned Season 1,2865,2022-10-07,18841
258791,813.4786458034924,Grocery,"VEGAN LIQUID NIGHTTIME MULTIMINERAL by MARYRUTH (Coconut) Highest Purity Natural Ingredients, Vitamins, Minerals, Magnesium & MSM builds tissue while providing for a deeper sleep. Never Sugar Added!",2612,2022-10-07,17496
258792,295.38602748589676,Beauty,"Aveda Hand Relief BB Moisturizing Cream, 8.5 Ounce",3176,2022-10-07,16148
258793,678.9736042657631,PC,Belkin Quilted Cover with Stand,2248,2022-10-07,47835
258794,354.8120777861575,Electronics,"Verbatim 700MB 52X 80 Minute Branded Recordable Disc CD-R, 10-Disc 97955",1810,2022-10-07,48556
258795,390.7349335734794,Music,One Voice / Til I Can Make It on My Own,1999,2022-10-07,20426
258796,827.0991461361339,Digital_Software,Macjournal 5.0,3411,2022-10-07,47172
258797,892.1579220310867,Digital_Ebook_Purchase,The Razor's Edge (Vintage International),2764,2022-10-07,38592
258798,223.38603269134907,Apparel,21 Century Clothing Unisex-Adult LA Print Sweater,2094,2022-10-07,49109
258799,323.6392626933138,Digital_Video_Games,Monument Builders: Titanic [Download],3070,2022-10-07,590
258800,331.1803613152759,Automotive,Triple Chrome Door Handle Cover Trims Fit Honda CR-V 2007 To 2011,2350,2022-10-07,1779
258801,530.7493693802517,Apparel,Disney Women's Minnie Mouse Microfleece Jumpsuit,2621,2022-10-07,38552
258802,211.20069621729226,Books,Perl Black Book: The Most Comprehensive Perl Reference Available Today,1324,2022-10-07,32864
258803,52.52600406799012,Music,On the Threshold of a Dream,3141,2022-10-07,15323
258804,880.6675335813131,Mobile_Apps,KIM KARDASHIAN: HOLLYWOOD,1434,2022-10-07,239
258805,423.81471213073837,Musical Instruments,Herakles by sense Authentic!,1933,2022-10-07,16292
258806,455.42473388330126,Music,American Beauty,1750,2022-10-07,27324
258807,398.77225563552054,Digital_Software,Cook'n Recipe Organizer Version 11 MAC [Download],3200,2022-10-07,38243
258808,59.02700468439504,Grocery,Non-GMO Project Verifed USA Grown 10 Lb Bean Pack (5 LBS Pardina Lentils and 5 LBS Green Split Peas) | Identity Preserved (We Tell You Which Field We Grew It In),3064,2022-10-07,46641
258809,120.63298617176558,Gift Card,Amazon eGift Card - New Baby Girl (Stork),2975,2022-10-07,45744
258810,252.9668735356291,Mobile_Electronics,SongStream Wireless Bluetooth Speaker Dock for iPhone 4 4S/iPod 30-Pin - Includes Remote & Free App By AT&T,2318,2022-10-07,35629
258811,744.0858765231452,PC,"Toshiba Satellite 17.3-inch laptop, AMD A8 Quad Core, 1600x900 HD+ widescreen, 6GB DDR3L, 750GB HDD, DVD SuperMulti drive, Jet Black (Free Windows 10 Upgrade)",2977,2022-10-07,21173
258812,929.8587259077689,Camera,AmazonBasics Backpack for SLR/DSLR Cameras and Accessories - Black,2686,2022-10-07,26564
258813,410.5813522316112,Outdoors,Sigma Pava/Hiro LED Light Set,2617,2022-10-07,17000
258814,620.1611790879797,Major Appliances,"SPT Under Counter Wine/Beverage Cooler, 32 Bottles",1174,2022-10-07,45324
258815,15.968010793956207,Major Appliances,"Samsung DMT300RFB 24"" Black Full Console Dishwasher - Energy Star",3324,2022-10-07,6515
258816,258.5350622329638,Major Appliances,Whirlpool : ET0MSRXTQ 24 9.7 cu. ft. Top-Freezer Refrigerator - White,3123,2022-10-07,23522
258817,256.5958643681639,Digital_Music_Purchase,A Lonely Grain of Corn,3282,2022-10-07,9072
258818,485.91869387125973,Books,Amanda's Wedding,3044,2022-10-07,41454
258819,514.3525885031142,Books,Where Souls Meet : Communicating with the Terminally Ill,2560,2022-10-07,13679
258820,20.31905555198132,Camera,"Maximalpower FC600 FUJ NP-50/KOD K7004 Rapid Travel Charger for Fuji NP50,Kodak KLIC7004, LI68, GE GB20,Minolta MINP1, Sanyo SLB0837",2388,2022-10-07,38027
258821,927.8915465820878,Music,Nightfall,1589,2022-10-07,2078
258822,265.79723617169316,Toys,Disney Frozen Complete Story Playset (Discontinued by manufacturer),1083,2022-10-07,3617
258823,208.18687492545794,PC,Aleratec SATA Data Cable 2.0 20in Serial ATA Straight Connector 6-Pack Combo,3136,2022-10-07,40621
258824,368.8211452862733,Books,Baskets and Basket Makers in Southern Appalachia,2676,2022-10-07,18162
258825,723.4630545459279,Office Products,At-A-Glance Notetaker Professional Monthly Planner (7073005),3591,2022-10-07,22423
258826,700.794367205261,Musical Instruments,Kirlin Cable Straight Premium Plus Instrument Cable,2307,2022-10-07,25122
258827,347.96761602326194,Musical Instruments,Fender Blues Junior Amp Cover,3302,2022-10-07,43007
258828,56.52360758922189,Office Products,Data Systems Manual Credit Card Imprinter (515-101-002),3506,2022-10-07,35995
258829,291.6353212427997,Digital_Ebook_Purchase,Building Your Book for Kindle,2258,2022-10-07,1808
258830,679.2588253442158,Music,I Love Beach Music 1 & 2,3023,2022-10-07,18551
258831,785.5134154300446,Musical Instruments,Olymstore(TM) Gold Plated Trumpet Mouthpiece - 7C Golden,1031,2022-10-07,32115
258832,153.71144938560568,Major Appliances,Whirlpool Washer Motor Coupling # 285753A,2965,2022-10-07,24525
258833,730.8030017031768,Camera,"Sigma 28-70mm & 70-300mm AF Lens Set For Canon EOS 50D, 40D, 30D, 20D, 10D, Digital Rebel XT, XTi, XS, XSi, & T1i Digital SLR Cameras",2853,2022-10-07,46055
258834,316.78405886862566,Digital_Ebook_Purchase,Deadly Pursuit,2616,2022-10-07,26463
258835,916.879999757571,Outdoors,"Independent Stage 10 129 Trucks (Set of 2, Standard, Black)",2511,2022-10-07,6600
258836,489.9684582553539,Mobile_Apps,Learn Piano,2886,2022-10-07,35808
258837,422.23282587835615,Furniture,Prepac Sonoma Entryway Cubbie Shelf,2268,2022-10-07,28735
258838,670.3683739100871,Apparel,Harley-Davidson Men's Black Label T-Shirt V-twin Short Sleeve Tee 30293148 (2XL),3377,2022-10-07,15676
258839,593.877089459537,Beauty,"Just For Men Mustache & Beard, Light-Medium Brown",1019,2022-10-07,10652
258840,967.0621676577022,Digital_Video_Games,Fallout 3 DLC: Mothership Zeta [Online Game Code],3375,2022-10-07,44831
258841,248.0167590378024,Outdoors,Kelty Shadehouse Accessory Wall Tent,3040,2022-10-07,2906
258842,235.6383155576589,Mobile_Electronics,Dakota Alert 3000 Wireless Vehicle Detection PIR Motion Sensor,1246,2022-10-07,46965
258843,378.3196982238821,Apparel,"Alexander Del Rossa Mens Fleece Onesie, Hooded Footed Jumpsuit Pajamas",1959,2022-10-07,5337
258844,512.6013234209083,Outdoors,Sunlite F-2 Magnetic Indoor Bicycle Trainer,2341,2022-10-07,31015
258845,746.3824241720095,Digital_Music_Purchase,Gold Cobra (Deluxe Version) [Explicit],2220,2022-10-07,6387
258846,921.3892385084945,Music,Tchaikovsky: Piano Concerto No. 1 / Nutcracker (ballet suite) excerpts ~ Gilels / Reiner,1368,2022-10-07,42163
258847,812.0825027549346,Grocery,"Bird-in-Hand Bake Shop Wet-bottom Shoofly Pie, Favorite Amish Food, 9 Inch (Pack of 2)",1387,2022-10-07,34953
258848,689.6406976535841,Camera,Panasonic Lumix 14.1 MP Digital Camera with 16x Wide Angle Optical Image Stabilized Zoom and 3.0-Inch LCD,2302,2022-10-07,28064
258849,639.0654268230595,Mobile_Apps,Kids Doodle - Movie Kids Drawing,2198,2022-10-07,19713
258850,421.824024365948,PC,EnergyPal Kindle fire 7 2015 case,3517,2022-10-07,35007
258851,501.9370789096396,Office Products,"Case-it The Chief Padfolio with Letter Size Writing Pad, Black (PAD-20)",1044,2022-10-07,16629
258852,98.74681953300939,Office Products,iPhone 5/5s Splash Series Semi-transparent Sunburst Case – Fashionable Design for Men and Girls – Cool & Fabulous Look for the Latest Trends – Perfect Custom Fit for Your Gadgets – Premium Quality Silicone Rubber – 100% Lifetime Guarantee! By Mobling®,2963,2022-10-07,47067
258853,261.6865162513569,Musical Instruments,32.8Ft /10M DC 12V Flexible 5050 RGB LED Strip Light With 44key LED Controller and 12V5A Power Adapter Non-waterproof for Indoor Decoration Novelty,1061,2022-10-07,46682
258854,877.5043169663338,Books,The Silence of the Lambs (Hannibal Lecter),2138,2022-10-07,21737
258855,533.742558431889,Office Products,Generic PG-210XL CL-211XL Variation-,2711,2022-10-07,45298
258856,863.0846250372014,Musical Instruments,PAIR (2X) MOJO CTS 500K Short SOLID Shaft Audio Taper Potentiometers / Pots - 10% Tolerance,2189,2022-10-07,21768
258857,359.98679030419436,Grocery,"Douwe Egberts, Aroma Variations",3371,2022-10-07,8547
258858,155.232799678904,Electronics,"Crosley CR8005C-BK Cruiser II Portable Battery Powered 3-Speed Turntable, Black",2665,2022-10-07,16977
258859,300.02675645988336,Major Appliances,"Aluminum/Carbon Range Hood Filter - 8 15/16"" X 10 1/2"" X 3/32""",1793,2022-10-07,31731
258860,671.1407595361644,Digital_Music_Purchase,Niña de fuego (Standard version),1020,2022-10-07,1187
258861,798.0755145265144,Camera,Kalt PC to Hot Shoe Adapter with Connecting Cord.,3560,2022-10-07,47169
258862,190.58608005921886,Digital_Video_Games,Little Italy - Hidden Object Games [Download],3606,2022-10-07,31963
258863,917.8751295928172,Office Products,"Eisen 10-pack Pencil Sharpener and Eraser Combo with German Blades, Assorted Colors (ESN-48010)",1043,2022-10-07,18955
258864,45.038379021893526,Beauty,Bath Body Works Moonlight Path Ultra Shea Body Cream 8 Once Tube,1583,2022-10-07,16850
258865,337.32161959028315,Digital_Video_Download,Invisible Invaders,1014,2022-10-07,22719
258866,860.4184729177564,Grocery,"Simply Gum, Assorted Natural Chewing Gum, Non GMO, Vegan, 6 Packs (90 Pieces) - Includes Mint, Cinnamon, Ginger, Fennel, Coffee, Maple",2747,2022-10-07,19569
258867,637.9458053311507,Mobile_Apps,4 Makeup Games,1173,2022-10-07,28440
258868,683.8555348309136,Digital_Video_Download,V/H/S,1936,2022-10-07,31379
258869,662.9523754825325,Apparel,Champion Men's Jersey Pant,1987,2022-10-07,29636
258870,892.9728477201339,Digital_Ebook_Purchase,An Innocent Client (Joe Dillard Series Book 1),3388,2022-10-07,38473
258871,543.7506377513279,Major Appliances,Pug Dishwasher Magnet (Fawn),2813,2022-10-07,13216
258872,108.88236717014351,Camera,WhiBal G7 White Balance Pocket Card,2443,2022-10-07,47239
258873,937.825397169376,Mobile_Electronics,"16 Gb BLUE Mp3 Mp4 Player with Fm Radio, Video Player, Picture Viewer By JEWELLCARE",1363,2022-10-07,16093
258874,776.0748221374134,Digital_Ebook_Purchase,Good to Great: Why Some Companies Make the Leap...And Others Don't,1393,2022-10-07,31244
258875,671.4163105686916,Baby,Luvable Friends 8 Piece Drooler Baby Bibs,1667,2022-10-07,36097
258876,327.2079464111922,Digital_Software,CorelDraw X7 Academic,3044,2022-10-07,47151
258877,235.44777057643932,Automotive,(2) Mirror Decals for SUBARU BAJA FORESTER LEGACY TRIBECA SVX IMPREZA STI WRX OUTBACK AWD TURBO,2202,2022-10-07,42054
258878,391.2525638218215,Musical Instruments,Walnut Wood Top Grand Piano Bench with Music Storage,2237,2022-10-07,18770
258879,284.78594428767843,Outdoors,JanSport Big Student Classics Series Daypack (Romance Red Twlight),2205,2022-10-07,22110
258880,533.3754760933904,Health & Personal Care,Atkins Endulge Treat,2889,2022-10-07,42385
258881,262.19372886305996,Digital_Music_Purchase,Party Up [Explicit],3601,2022-10-07,20613
258882,308.51789228472734,Books,Forever Craps,3397,2022-10-07,1313
258883,209.48671017523483,Music,Mermaid Avenue Vol. II,3436,2022-10-07,12251
