sale_id,sales_amount,product_category,product_name,location_id,date,customer_id
93505,316.1852908798023,Books,Annie's favorite crochet dolls,3404,2019-09-27,25019
93506,914.0330842181922,Mobile_Electronics,VM Audio Shaker Series SRW DVC Car Suwoofer,1073,2019-09-27,46870
93507,379.7016030084361,Camera,Sony HVLF20AM TTL Digital Flash for Sony Alpha Digital SLR Cameras,1354,2019-09-27,16251
93508,856.1169233578902,Health & Personal Care,"Generic Flat Cellophane Bags with Adhesive Closure, 5"" W x 7"" L, 100 Pack",1172,2019-09-27,6717
93509,703.1661070458538,Apparel,Long India Tunic Top Womens Kurti Embroidered Cotton Blouse Indian Clothing,1864,2019-09-27,1368
93510,444.49642412310754,Books,How We Got Here: The 70's: The Decade that Brought You Modern Life (For Better or Worse),3357,2019-09-27,46978
93511,999.0781467836597,Digital_Video_Download,84 Charing Cross Road,3526,2019-09-27,18744
93512,450.1277402861994,Grocery,Dick and Jane Educational Snacks,2748,2019-09-27,35311
93513,786.1232980283262,Beauty,"Bed Head Bh307cn1 Totally Bent Chrome Crimper, 2-Inch",3204,2019-09-27,31815
93514,913.3177276774793,Books,Leonardo: The Last Supper,2304,2019-09-27,44908
93515,457.18313092493634,Electronics,JIAKE Universal Wireless Headphone Bluetooth 4.0 Music Stereo Headset Vibration Neckband Style(White-Blue),3602,2019-09-27,13383
93516,43.54361079150575,Electronics,"SF Cable, 1ft Ultra Low Profile Angle NEMA 5-15P to 5-15R with 12 inches 16/3 AWG SJT",1244,2019-09-27,1820
93517,481.44243465795387,Digital_Ebook_Purchase,Reflections on Sacred Teachings III: Harinama Cintamani,2163,2019-09-27,18845
93518,466.4469204454634,Major Appliances,14 Lbs.Top Load Portable Washer Color: Platinum,1327,2019-09-27,24763
93519,368.45528181867684,Musical Instruments,SUPERNIGHT 16.4ft 5050 300leds Waterproof RGBW LED Strip Flexible Light - Black Roll,2188,2019-09-27,29105
93520,168.43809011988355,Health & Personal Care,Shibari SHIB-WHT Magic Wand Power Massager,3566,2019-09-27,14265
93521,65.69801048999969,Furniture,Revival 550H2 Area Rug,2511,2019-09-27,23919
93522,111.61917030749282,Digital_Ebook_Purchase,Ripple (Part 2),2723,2019-09-27,49808
93523,854.3217773560507,Musical Instruments,Turntable Lab: Rostarr x Turntable Lab Audiosetup Slipmats - Supersoft / Single,2451,2019-09-27,9949
93524,177.3976219525976,Office Products,Sony XL-2400 Replacement Lamp for Grand WEGA 3LCD Rear Projection HDTV,3496,2019-09-27,37772
93525,350.34625675214016,Grocery,Volcano Dust 2 - Smoked Habanero and Bhut Jolokia (Ghost) Powder,3557,2019-09-27,22045
93526,737.8018897129374,Electronics,Atlantic Media Multimedia Stix Storage Rack System,1136,2019-09-27,30676
93527,85.31972671943917,PC,"Yapster Plus Headset for PC, MAC, Tablets and Smartphones",2835,2019-09-27,45761
93528,210.3487808823919,Apparel,Allegra K Women All Over Hearts Short Sleeve Roll Up Cuffs Cozy Fit Blouse,3230,2019-09-27,31186
93529,360.1287849094101,Beauty,"Degree Men Dry Protection 48 Hour Antiperspirant, Cool Rush 2.7 oz (Pack of 6)",3090,2019-09-27,19096
93530,647.2862506534734,Grocery,#1020-A Giant SUNZILLA SUNFLOWER*25 seeds,1656,2019-09-27,27229
93531,486.5955803717119,Electronics,Estone 3.5mm Female to Dual Male Mic Audio Y Splitter Cable Extension Cord For PC,2283,2019-09-27,15706
93532,808.3457967121318,Musical Instruments,Behringer 2154656 POWERPLAY P1,2799,2019-09-27,29395
93533,433.585042906879,Major Appliances,Fisher & Paykel : DD24DCX6 Semi-Integrated Double DishDrawer - Stainless Steel with LCD Display,3232,2019-09-27,35722
93534,121.26981011869893,Musical Instruments,The Realist Double Bass Transducer Pickup For Bass,3564,2019-09-27,18412
93535,442.8373529383097,Automotive,Nissan 350Z Stamped High Quality Chrome Plating Cast Zinc License Plate Frame,3099,2019-09-27,46495
93536,444.29702193553567,Baby,Graco TableFit Highchair,2312,2019-09-27,29648
93537,771.8779821613913,Books,Great Expectations (Penguin Classics),1326,2019-09-27,47622
93538,958.8293515285565,Apparel,French Connection Women's Mini Paisley Party Dress,1821,2019-09-27,5890
93539,583.200140109046,Mobile_Apps,Yahoo Mail – Keeps you organized!,1113,2019-09-27,30092
93540,632.1152834165846,Books,Northanger Abbey (Penguin Classics),2997,2019-09-27,45246
93541,309.1195440777908,Automotive,YTX4L-BS YT4L-BS CB4L-BS GT4L-BS Motorcycle Maintance Free GEL Battery,3180,2019-09-27,8991
93542,947.0557389001006,Major Appliances,Nostalgia Electrics Retro Series Compact Refrigerator with Dispenser,2550,2019-09-27,1854
93543,427.30108589360805,Camera,JVC GZHM670BUS Camcorder with 40x Optical Zoom and 2.7-Inch LCD Screen (Black) (Discontinued by Manufacturer),3351,2019-09-27,43488
93544,340.17282121779954,Books,Dance Hall of the Dead,1581,2019-09-27,22507
93545,272.0170717603227,PC,Mechanical Keyboards Inc Wire Keycap Puller Tool,2269,2019-09-27,19522
93546,122.7519632474178,Health & Personal Care,"Superior Labs – Best Natural Biotin NonGMO Supplement – For Luscious Longer Hair and Lashes – Stronger Nails – Healthy Skin – Energy Booster – Healthy Weight - 5000 mcg, 120 Vegetable Caps",3483,2019-09-27,35502
93547,754.0488598872618,Camera,"Polaroid 57"" Photo / Video Tripod Includes Deluxe Tripod Carrying Case For The Canon Digital EOS Rebel SL1 (100D), T5i (700D), T5 (1200D), T4i (650D), T3 (1100D), T3i (600D), T1i (500D), T2i (550D), XSI (450D), XS (1000D), XTI (400D), XT (350D), 1D C, 70D, 60D, 60Da, 50D, 40D, 30D, 20D, 10D, 5D, 1D X, 1D, 5D Mark 2, 5D Mark 3, 7D, 6D, EOS M Digital SLR Cameras",1044,2019-09-27,26762
93548,996.5043763725653,PC,SABRENT 2.5-Inch SATA Aluminum Hard Drive to USB 2.0 Enclosure (EC-US25),1043,2019-09-27,32523
93549,533.1932938736827,Major Appliances,Haier HBF05EBSS Draft Beer Dispenser,2111,2019-09-27,26254
93550,737.3826360032899,Digital_Video_Download,Man Seeking Woman Season 1,3366,2019-09-27,33104
93551,905.4427929395279,Automotive,The Power Probe Gold Series Lead Set,2331,2019-09-27,49740
93552,20.29328988375302,Automotive,Sorry For Driving Sooo Close In FRONT of You Car Decal / Sticker,2094,2019-09-27,47798
93553,807.0299234059516,Beauty,"Wahl Professional Balding 6X0 Clipper Blade 2105 - for the 5 Star Series Balding Clipper - Includes Oil, Screws and Instructions",2966,2019-09-27,9402
93554,226.70619694775846,Digital_Software,Kaspersky Total Security - 5 Devices,1138,2019-09-27,37486
93555,377.2479588672038,Digital_Music_Purchase,The Visual of Poetry in Audio,3184,2019-09-27,21235
93556,630.2274575397383,Outdoors,"Cressi Palau Long Fins, Focus Mask, Dry Snorkel, Snorkeling Gear Package …",1862,2019-09-27,12539
93557,17.513571477156965,Mobile_Apps,Glamour Girl™ - T-Shirt Designer Free,3044,2019-09-27,7992
93558,574.3604175590397,Apparel,California Costumes Women's Silver Screen Sinsation Costume,1923,2019-09-27,43703
93559,547.9134257565668,Digital_Video_Games,The Stronghold Collection,3609,2019-09-27,949
93560,556.5070382959748,Electronics,TBS Splitter,3494,2019-09-27,19434
93561,243.80048673578872,Health & Personal Care,"Enzymatic Therapy - DGL Ultra, German Chocolate Flavored, 90 Chewable Tablets",3099,2019-09-27,8166
93562,373.93324211214735,Health & Personal Care,"TONYMOLY Egg Pore Shiny Skin Soap, 0.9 Ounce",2919,2019-09-27,34633
93563,610.0927574502521,Mobile_Apps,Spider,2684,2019-09-27,12675
93564,969.7122874750867,Digital_Ebook_Purchase,The Elite (The selection Book 2),1526,2019-09-27,48106
93565,883.1184104620575,Mobile_Apps,Pet Rescue Saga,1947,2019-09-27,37965
93566,339.1401289664339,Musical Instruments,"On Stage MS7701C Tripod Microphone Boom Stand, Chrome",1475,2019-09-27,45894
93567,406.99768525318495,Apparel,Young Hearts Little Girls' 2 Piece Star Long Sleeve Fashion Pant Set,2328,2019-09-27,34243
93568,154.49082714539222,Digital_Ebook_Purchase,A Clean Kill in Tokyo (previously published as Rain Fall) (John Rain Book 1),1762,2019-09-27,123
93569,533.7439847917375,Digital_Music_Purchase,B-Sides And Live (2001 - 2005),2792,2019-09-27,10890
93570,226.26235460871828,Outdoors,"Sanyo KIR-SE1SW Kairo Hand Warmer with Rechargeable Lithium-Ion Battery, Pearl White",1438,2019-09-27,11280
93571,378.95581873451647,Outdoors,Shimano XT FD-M770/M771 Front Derailleur,2616,2019-09-27,3191
93572,802.9567340566742,Digital_Music_Purchase,Hawaiian Wedding Song,2916,2019-09-27,36883
93573,677.1541190571417,Apparel,Womens Genuine Leather Credit Card Holder Case Super Slim Genuine Leather Bright Colors,1485,2019-09-27,33182
93574,899.514546761048,Outdoors,STREAMLIGHT SL-20 SL-20S SL-20X MINI STINGER 200394 20X1701 40070149 41B038AF00101 9032 ARXX075 MA5 ML500 ML5000 RX1019 Energizer 41B038AF00101 Moltech Power Systems N38AF001A 5 Sub 1/2 D,2204,2019-09-27,979
93575,320.37559507150377,Music,Modern Music,1815,2019-09-27,29565
93576,957.3412875407745,Books,"A Dictionary of Moroccan Arabic Moroccan-English, English-Moroccan",3430,2019-09-27,40693
93577,468.59009625984066,Baby,Doc To GO Pediatrician Designed Infant and Toddler Healthcare and Grooming Kit,2047,2019-09-27,46855
93578,138.36352031062134,Beauty,Puracy Natural Body Wash,1926,2019-09-27,42547
93579,273.3183582073031,Office Products,"Pentel EnerGel Deluxe RTX Retractable Liquid Gel Pen, Needle Tip",1491,2019-09-27,41914
93580,449.0262050611695,Digital_Video_Download,Shuttle,1278,2019-09-27,33630
93581,235.43005569828384,PC,"Newest Model Toshiba Satellite C55D 15.6-inch Laptop - AMD Quad-Core A8-6410, 4GB DDR3L, 1TB HDD, 1366 x 768 HD Display, DVD±RW/CD-RW, Webcam, HDMI, Windows 8.1 64-bit",2943,2019-09-27,39676
93582,153.0019005733733,PC,TOP CASE Zipper Sleeve Bag with Handle and Pockets,2585,2019-09-27,4068
93583,55.66611673317106,Digital_Ebook_Purchase,Trouble in Mudbug (Ghost-in-Law Mystery/Romance Book 1),3508,2019-09-27,274
93584,732.2282773865143,Automotive,TRICO Teflon Shield 20-140 Premium Hybrid Wiper Blades,2337,2019-09-27,9710
93585,194.34154085573113,Outdoors,Electra Checkerboard Bicycle Mirror (Black),1958,2019-09-27,5866
93586,121.64534841915939,Major Appliances,"Whynter BR-128WS Beverage Refrigerator with Lock, 120 Can Capacity, Stainless Steel",2038,2019-09-27,38736
93587,232.25491675805952,Automotive,Koolatron Traveller lll Thermoelectric Cooler,1869,2019-09-27,45135
93588,764.1964543115307,Furniture,Harbor View Entertainment Credenza,1616,2019-09-27,44600
93589,960.127614049094,Mobile_Electronics,CoCoon Waterproof Snowproof Dustproof Shockproof iPod touch 4th Generation case,2644,2019-09-27,22782
93590,659.1036692685256,Musical Instruments,Novation USB Midi Controller Keyboard,2046,2019-09-27,40569
93591,226.26145046661767,Digital_Ebook_Purchase,The Slickrock Cafe (Bud Shumway Mystery Series Book 2),3434,2019-09-27,7584
93592,822.4041340429736,Digital_Video_Games,The Typing of the Dead: Overkill - The Filth of the Dead [Download],2281,2019-09-27,15483
93593,379.6527651598886,Furniture,FunTime FT421CB Carnival Style Hot Oil Popcorn Machine,2770,2019-09-27,42239
93594,85.01548285747798,Beauty,"Panasonic ER421KC Ear and Nose Trimmer with Grooming Light, Wet Dry Convenient",1747,2019-09-27,36299
93595,236.13935167155066,PC,Laptop/Notebook AC Adapter/Power Supply Charger+Cord for HP Pavilion DV2300 DV8900 dv2800 dv5100 dv5298ea dv6408nr dv6604nr dv6605us dv6609wm dv6625us dv6626us dv6627nr dv6628us dv6629us dv6633us dv6707us dv6810us dv6815nr dv9720us dv9810us dv9830,2854,2019-09-27,7928
93596,52.13485460065805,PC,NETGEAR WNCE2001 Universal WiFi Internet Adapter - Manufacturer Refurbished,2344,2019-09-27,33939
93597,379.7438153800639,Digital_Ebook_Purchase,I Shall Live: Surviving the Holocaust Against All Odds,3131,2019-09-27,34316
93598,654.3915337685058,Digital_Music_Purchase,Real Life,2305,2019-09-27,43304
93599,624.7376537055103,Office Products,ELMERS X Acto Manual Pencil Sharpener (1065),2034,2019-09-27,18556
93600,817.8782392017266,Digital_Video_Download,Family of Spies,3459,2019-09-27,25342
93601,680.2454278161772,Apparel,Womens Casual Slim Fit Ink Painting Print Plus Size Linen Dress,2385,2019-09-27,7586
93602,291.53476506503955,Major Appliances,"Samsung RSG307 30 Cubic Foot Side by Side Refrigerator with 2 Doors and Integrated Water & Ice,",3562,2019-09-27,38196
93603,54.27000348056845,Musical Instruments,Snark SN-8 Super Tight Tuner with ChromaCast Guitar Pick Sampler,3053,2019-09-27,23818
93604,786.9845555196997,Gift Card,Amazon eGift Card - Thank You (Typography),2295,2019-09-27,24451
93605,744.6813616488694,Major Appliances,HOMEIMAGE DUAL-ZONE Thermo Electric Wine Cooler with Wooden Rack for 21 Bottles - HI-21D,3316,2019-09-27,8805
93606,798.1271456082234,Camera,Giottos Rocket Air Blaster Large - Black,3307,2019-09-27,7400
93607,782.8300863373485,Baby,Itzy Ritzy Snack Happens 2 Count Snack Mini Reusable Snack Bag,3356,2019-09-27,3369
93608,342.8635132491718,Grocery,neat Meat Substitutes,2816,2019-09-27,30353
93609,466.0378947665223,Digital_Video_Games,The Grand Hotel - Hidden Object Game [Download],2587,2019-09-27,33447
93610,311.4964574518158,Furniture,0327 Red White Black Area Rug Abstract Carpet,2601,2019-09-27,38062
93611,463.86268777040334,Baby,American Baby Company Waterproof Embossed Quilt,1982,2019-09-27,10013
93612,242.68056907458907,Digital_Music_Purchase,Until the End and After,1446,2019-09-27,14733
93613,659.4541820938877,Grocery,Viva Labs Organic Chia Seeds: Raw and Non-GMO,1054,2019-09-27,46537
93614,557.5239719657125,Mobile_Electronics,iPod Nano TPU Skin Case Cover,1635,2019-09-27,37479
93615,156.33709841418917,Digital_Video_Download,Presumed Innocent,2808,2019-09-27,9072
93616,260.4222431974491,Apparel,Suddora Shoelaces - Pair of Tubed Multi Colored Shoe Strings,1771,2019-09-27,49572
93617,952.2964030366443,Automotive,"Superior 58-0900B Massage Sport Grip Slip-on Steering Wheel Cover, Black",3225,2019-09-27,16148
93618,169.26670165866423,Beauty,"Right Guard Total Defense Clear Stick, Fresh Blast, 2-Ounce Units",2724,2019-09-27,8259
93619,534.0648152748976,Baby,Munchkin Mozart Magic Cube,1090,2019-09-27,37841
93620,18.99527776075881,Furniture,Ultimate Dreams Crazy Quilt 7 inch TriZone Mattress,2618,2019-09-27,13929
93621,169.39908517935828,Apparel,London Times Women's 3/4 Sleeve,2097,2019-09-27,43775
93622,535.705422070004,Digital_Music_Purchase,So What,2595,2019-09-27,36583
93623,790.157371907316,Baby,"Ulubulu Universal Pacifier Clip, Oliver Owl",1140,2019-09-27,17395
93624,334.18255620121965,Electronics,Elivebuy surge protector and usb charging station,2156,2019-09-27,12627
93625,330.7347558834453,Beauty,Roux Porosity Control Shampoo 15.2 Fl.Oz,1348,2019-09-27,23128
93626,771.1918323338614,Digital_Video_Games,Ricochet Infinity,1493,2019-09-27,33030
93627,881.0711221959837,Musical Instruments,Kala Mahogany KA-15s-RLE Mahogany Soprano Ukulele,2470,2019-09-27,9862
93628,431.37611094796904,Automotive,IV2 Dual Visor Modular Flip-Up Motorcycle Adventure Touring Helmet [DOT],1700,2019-09-27,685
93629,650.1851052415908,Major Appliances,"Frigidaire Gallery DGUS2645LF 36"" 26 cu. ft. Freestanding Side-by-Side Refrigerator in Stainless Steel",1491,2019-09-27,20089
93630,686.1052459257661,Major Appliances,"LG LMVH1711ST Over-The-Range Microwave with 1500-watt Convection Technology, 1.7 Cubic Feet",3546,2019-09-27,20754
93631,769.677787241495,Office Products,"LD Remanufactured Replacements for HP 88XL / 88 HY Ink Cartridges Includes: C9396AN, C9391AN, C9392AN, C9393AN",3306,2019-09-27,10606
93632,736.827626469328,Health & Personal Care,"Acc U Rate Pro Series 500D Deluxe Fingertip Pulse Oximeter Blood Oxygen Saturation Monitor with silicon cover, batteries and lanyard",2823,2019-09-27,5087
93633,806.3176467929951,Music,Center Stage (2000 Film),1880,2019-09-27,16004
93634,296.87274144522746,Electronics,Super Power Supply® DC Car Charger Adapter Cord for Venturer Portable DVD Player Pvs3310 Pvs33106 Pvs3361 Pvs3368 Pvs33701 Pvs3377 Pvs3389 Pvs3393 Pvs6081g Pvs6100w Pvs6271 Pvs6281 Pvs62911 Pvs6360 Pvs6370 Pvs6970 ; P/n Sp0902200-w01p 133-034400-000 133034400000 Barrel Plug,2740,2019-09-27,21295
93635,848.9114526590236,Mobile_Apps,Smash Hit,1191,2019-09-27,34450
93636,836.9696920746554,Mobile_Apps,The Amazing Spider-Man (Kindle Tablet Edition),2268,2019-09-27,39583
93637,522.2481361794934,Digital_Ebook_Purchase,Locked On (A Jack Ryan Novel Book 12),1629,2019-09-27,38394
93638,985.1438022019855,Camera,eForCity Compatible with PANASONIC LUMIX DMC-FX07 CGA-S005 BATTERY CHARGER,3466,2019-09-27,205
93639,602.1060293592419,Mobile_Electronics,SECUDA High Quality USB Programming Cable For Yaesu/Vertex Standard Radio VX-530 VX-600 VX-800 VX-900 VX-4000 VX-5500 VX-6000 Multi-pin,3450,2019-09-27,38153
93640,997.2428513863734,Digital_Ebook_Purchase,The Casual Vacancy,1395,2019-09-27,8772
93641,150.15087994860428,Mobile_Electronics,BeatsByDre PILL2K Pill 2.0 Wireless Bluetooth Speaker Black,2136,2019-09-27,27524
